tweet_cleaned,class
bitch mob bad health,1
nicca need time bepatient,1
hell pussy print page,1
got mom as breath pussy,1
oreo cheesecake bite,2
want get nose bad bois scally chav sockfetish stinking hot sox leg,2
tweet booby trap caught hoe,1
wan sex mom fuck right pussy came damn got hacked like fuck,1
obviously talking cod game queer,0
reading sexual assault case take back collegeill never forget walk would say dont run train hoesstraight trouble,1
sick self serving politician standing trash america wearerepublicnotregime impeachobama,2
get hit bitch campus want,1
vega day bitch,1
pau hoe gon play trade deadline dislike guy yea helped bring two chip soft,1
listening bitch complaining nigga aint even,1
yall hoe need get much life fuckin hater get,1
change bitch everything example girlfriend dont like crew hang bae,1
like bitch typical shit stepping place elliptical shit wizard heart mythical shit watch mystical shit,1
scrappy mom run bitch away,1
chest kobe getting docked calling ref faggot yall,1
dude try fuck bitch behind back tell aint good happend,1
confusing circumstance seem get way high virgo,2
get argument someone say nice life good luck ohio thats fuck bitch leave,1
gim one mouth closed cant draw teeth without making look retarded omf,1
bathing sphere suspended orb tub shy people bathing design weird yet cool,2
nigguh stay doin,1
wtf boy pussy lmao atl nigga sick,1
dont cry stripper bitch left dude money tho singing,1
rihanna talented hoe,1
gon ape shit uchida,1
reason rap pussy supposed talk smh bout make music aint negative,1
stay away bitch insecure wildning public say immature,1
myspace died couple year ago facebook hospital twitter strip club throwing one big booty hoe,1
hoe,1
want come buy aint mufuckin fronting nowadays niccas playing game hunned loud,1
would want girl stand man bitch letting,1
brother thincc playing keep putting fuccing wit ill break bitch burning uuuup,1
ever kill ant sidewalk think damn nigga way get pussyno must chance,1
need get outta bitch meridian bad long getting paper good,1
get pussy quicker day,1
stop whacking shower queer boy,1
hayfever cunt,1
supposed hang week nigger,1
bitch lagging lol,1
catch fuckin tonight nolinenowait bitch well meetmethere,1
god thinking lol people school showing nigguh video like famous os,1
bitch song ifihadme,1
kangaroo jac bitch wit dry weave fuck look like hoe,1
taste like wolf pussy,1
guy say dont wear legging dont got as see pussy walking around muscle shirt without mu,1
bitch,1
tried bit bottom lip like snack bitch,1
lmao play getting pussy easy believe youre omar eppss brother steelers head coach son,1
duh youre main bitch,1
steak category ran bitch like busto,1
charlie brown,2
said dont like taste like wolf pussy even know taste like,1
brandon jennings trash,2
bitch need get bed ill make cheeseburger imahomie,1
game beat glocc full video via bitch cop cant,1
wow white people cracker guess one,1
wow thats great language coming coach sure role model youre trash like account,2
better nig lol anything ill flip something tryna get cash,0
tell hating niggah stfu,0
seen baddest bitch tower city heart got warm,1
smh bitch sellin as,1
jim crow law segregation lynching law anti woman suffrage law amazing everyone doesnt want bring,2
bad former psyqo nigger like anime,1
feelins hoe aint main thang niggahs thang niggahs gangbang,1
freaky bitch eat dick playing madden,1
hoe,1
sound like major bitch area,1
trip acid bitch,1
white trash okies dont count real white people count white person count person okies arent people,0
coach say player wont need motivation get back track following paul george injury rather theyll play,2
likely sign crazy bitch aries taurus gemini cancer leo virgo libra scorpio sagittarius capricorn,1
god damn flappy bird weak as,1
charlie crist asked keep poll broward open claiming long line medium report say turnout light broward,2
mine obvious people gna hit cause obviously attractive flirt back problem bitch,1
guess niccas think owe money long youll forget,1
fat bitch normal sized leg looking like car key,1
yall act like pussy something magical nigga suddenly didnt pull naw didnt pull,1
jealousy bitch,1
money world couldnt get real bitch priceless,1
spike lee one wealthy people bitch thats causing gentrification,1
ima bos as bitch bitch bitch,1
bitch sometimes,1
always look nice gon buy yellow one,2
finally see white kid called nigger call duty,1
trash aint,2
sorry fanreally justin come back top comment justin timberlake video million view son fucking bitch,1
neverrr play stupid far bitch might stupid,1
like yankee toinight,2
wasnt bad though drawing conclusion white america based person poll slippery slope,2
everything cut bitch,1
cant hear pussy smacking aint wet enough,1
niggah friendzoned daaaaaaaam,1
dollar every time fucked bitch,1
as wont hoe,1
try one mikey none hick shit,1
goku shutting hoe since,1
lol nigga look like combo trash house trash dump,1
hoe spice,1
tweeting boyfriend wont get xbox live nigga got kill streak bitch shut,1
real nigga shit bitch need slapped,1
hot isi social medium photo laughing jihadis get baby kick severed head warning graphic tcot pjnet,2
minute red yellow rent sign reg ppl start selling move,2
neck titty pussy,1
man bitch computer really fucking compete,1
theboondocks nicca,2
prego bitch need one milk whole box cinnamon toast crunch man,1
cant see real woman yourside thick thin maybe deserve hoe,1
take trash today outnumbered thankfully dismembered thanks lady,2
fucking hot scally sneakersex sockfetish sniff trainersex love kinky scallies,1
fuck talkin like guy asks number say ugly bitch say,1
couple bitch header ioeno,1
nigs like saying miss old vice,1
yeah bitch hit get friend zoned brody,1
dont know hoeless dont know congregate,1
gwb appointee go activist judge slant wait already exposed completely farcical gwb appointee,2
thats fav part take carewhole album trash,2
hoe loyal,1
support niggaz bitch dope shit west side city,1
like bitch didnt make cut,1
ugly girl fight pretty bitch hand lol,1
another black man anything monkey always monkey chicago idiot,1
name wu song wu hoe overgrown thot,1
rather ask nappy headed hoe grandma well ashamed family,1
abed look like take shit bro pic brolic boyswhotakepicsinsuits tie swag hoe,1
dont get panty twist take let tongue twist around pussy instead,1
prolly leave bitch cup hand hand hand,1
hangin corner late pocket wasnt straight bitch aint gon make rate dawg know sayin,1
weight issue mine really need good bitch slapp,1
dude girlfriend mom trash wedding mope folk rock explainafilmplotbadly,1
nothing wrong ariana grande cause dont look like hoe yall got problem,1
ibs irritable bitch syndrome,1
bitch,1
drinking veuve cliquot eating marshmallow basically classy bitch,1
know moment people especially guy excuse trusting fucked around hoe,1
woman stay bragging man penis wonder friend fucked himsmh silly silly hoe,1
literally told face trash shop hooping,2
lifetime cray,1
christianbale kissing moses as fight god otherwise might fucking dead retarded as actor faggot,1
new bus stop guy across street yelling david lee roth kick swooping crow learn karate,2
pic trash dck dry,1
conclusion lois lerner giant bitch,1
stranded desert island could bring thing would bring dora hoe everything backpack,1
work right bitch,1
right bitch saying positive vibe bitch making fun someone weight,1
mean sometimes eating carton double stuf oreo option,2
nigga wearing tom uggs bitch wearing jay timbs lol aint usher meant said trading pla,1
girl wear bathrobe still cuz really cute fuzzy bathrobe victoria secret even wear,2
lol fuck lil bitch aint shit peep wassup tho,1
somebody take oreo away eat whole pack,2
organizing cease fire bald headed bitch weave,1
red light decatur lake mead bitch knew happy see melike bitch finna get passenger seat,1
water wet nike trash,0
fucking twat xavi checking grass haha,1
hoe back root,1
fuck broke bitch,1
aint hoe get trap hoooouusssee,1
tweet dont text back fag,1
girl know spitting shit going lbvsbitch plz,1
trash bag full barely tie sttooopp,2
yeah bitch know hot shit back day,1
ike punch nigga harassing young lady ave florida ave youoksis,1
fronting bitch get got island dick never hit fronting as nigga,1
cant yankee make last week move,2
like rape bitch posted,0
let support niccas matter,1
thanks hun haha,2
always fat bitch handicap spot never dude wheelchair,1
janemba better pussy as,1
aight bet bitch,1
dont get twisted shit bow bitch,1
bitch love bitch love bitch love aint fuckin dougie,1
freeze bitch gon steal heart,1
thats type bitch hate,1
bitch throwing condom lmao,1
ghetto as nigga suburban,1
yall fuckin trash man nigga gon win skin trash,1
ding ding ding sagittarius trash,2
almost blacked little cunt disrespecting turtle dont disrespect gorilla,1
someone bitch slap lake see tomorrow suspect hard core gop friend,1
sitting deck enjoying stoneipa watchingsmelling neighbor burn trash missouri,2
ion sneak dis broke bitch,1
lady pussy sound like please hit dm need science project,1
walk party boot hoe,1
dude seriously retarded stop talking like ill start retarded make change drool cup,1
bitch as,1
ive never problem anybody ive company year snitch fucking bitch trying get fired,1
know shes dyke asks men golf club,0
tweeted cant concentrate enough read sadlooking boob pussy pic men prob,1
sex reward relationship nigga never done anything whatsoever yet still give pussysmh,1
talking pucture pussy cat nit twit,1
pregnant cupps classic response liberal dem call chunky bonus tweet via,2
planet ape king kong clip,2
pussy pussy pussy smell frum bout mile away,1
thats lil nig,1
apparently honky pfft like thats bad thing,2
pretty close trash as nigga quote ill guess body count,1
forgot youre bull said yeezus good jcole trash,2
stop pussy son shove needle heart afterearth,1
bitch please,1
austin mahone making bitch horny right,1
fucking bitch,1
cant give hoe inch cuz theyll try take mile,1
fat toothless sack chasing bitch yelled busted as van window fuck get real job,1
last bitch fucked mixed breed,1
charlie,2
girlfriend taller responsibility take trash fight anyone break,2
amennn girlfriend doesnt like bitch dont talk bitch,1
like bitch aint even attractive smh,1
bitch,1
bitch trash pussy always want unprotected sex,1
sometimes like wow bitch audacity talk shit look life look mine,1
askin negro lol,1
got as bitch got hip bitch got thigh bitch fine bitch bad way live,1
pussy cat lounge killin girlz,2
bitch aint real,1
lmao fucking snake bitch,1
bitch thats sure,1
supposed know butch dyke yeen got beard man,1
goodbye faggot,1
world cup diary argentina mock brazil twirling towel photo getty,2
call cock blocking faggot,0
cant get money silly hoe,1
girlfriend hate friendly bitch,1
lonely hoe,1
bitch new amount shit spoke bout twittah lol,1
real shit bitch want grape something thats different,1
nephew keep tryna kiss like bitch got zero follower dismiss,1
said thats bitch bitch look,1
dont fuck widd baby as bitch word deja lol,1
nigger made shit coffee,0
bill bellicheck wouldnt give interview pussy hey bill karma bitch,1
depends female dawg usually thats hoe genuine woman fuck,1
bitch bad,1
everyone say letsmakeitawkward queer justmadeitawkward,1
bet charlie strong contacted ridley,2
well maryland bunch hateful redneck anyway,0
triesto cause drama people said called bitch know didnt hahahaaha,1
bitch nan,1
fake eyelash okay look natural bitch look like gon take flight blink,1
eda queer lol,0
fucking fag exactly talking woman pig,0
bbw shit get planet take stud hoe,1
dont give flying fuck teabagger piece human garbage like think,0
fucking around two bitch never made hoe mistress,1
autocorrect bitch,1
he cheating wetback,1
note dis bitch,1
slapahoe,2
steelers new uniform look like homosexual bumblebee wtf,1
daughter seen charlie villanueva question,2
said uswas full nicegivingsmart ppli thought meanunexceptionalbitter clingersevolved,2
use coconut oil faggot,1
bitch sweetheart feel,1
bye bitch,1
hoe aint loyal,1
soft shit handicapped retarded,0
make wise argument accelerated warholian notion celebrity era vine passing teen mock old wrinkled ball,1
nope super chocolatey yummy brownie,2
love people use twitter bitch complain fuckyou,1
blac chynas as shouldve threw first wop sided cheek piercing trashy hell,1
besides imposter idol look nothing like word god described saviour israel revelation envious bitch,1
eat pussy taste like mold stop cant tell ppl ate aint finish,1
emoji as nigguh,1
wigga,1
need new bitch,1
play wit pussy nigga,1
never happen much republican redneck oil money sad butt true corruptamerica,1
got ounce bitch,1
ran thru bitch fallin love,1
lost respect brother cause acting like straight bitch,1
happy valentine day big booty bitch,1
bih stay ghetto as neighborhood,1
dont worry nigga see worry nigga dont see dat nigga fuckin bitch,0
fuck put block cheese room without refrigerator ghetto as nigga eas like thats thing wrong,1
reasonswecantbetogether talkin nig smashed homies,0
imma bitch know leave alone,1
fucc hoe dat feel,1
get retweets thats proof get bitch let settle,1
jus dont faithful cu never kno bitch lmao,1
sonnen faggot,0
stop retweeting heather tired seeing bitch,1
feel like niggah pac bitch set,1
bitch grade talking bae bitch credit,1
nigga cant stand cuz bitch feelin nigga get mad called girl,1
dude problem deciphering sex tooside bitch get wifely loveyou cant keep secret youre overdoing dirt,1
bad bitch thing like,1
bitch watch fucking mouth dirty whore swear god thats thin line,0
fucking pussy thats exactly let nigga talking,1
doctor available examine pussy testicle penis painlessly possible,1
said something gorilla stop listening monkey music,1
wintertime bout turn grind back dont spent enough money wit niccas,1
boy discover hoe,1
free lee bitch,1
coward afraid showing faithjust another devil bitch,1
isnt green one either there red yellow pic,2
rev charlie rangel union stand spiritual damn thing like inflatable rat,2
ask every bitch gayor,0
clean dead bird piece glass,2
act like age like cute awk moment thought tweet abo,2
far today every time try load article blaze twitter site crash wtf selibus cunt,1
hii fag,1
asha little voice head telling fuck hoe wasnt kendra,1
lol liked album double album trash sonsmh,1
dumb bitch lol,1
broke people say bitch nigga afford speak,1
men biggest hoe lmao,1
babymama drama side hoe,1
knowww righttt dont even know use shit update status hoe,1
smh queer,0
mother fucken sexy time retard,1
youre still pussy,1
shootas grandmama house aint around bitch ina minute,1
ear look good hoe background,1
dick sad life hair mess family nut neighbor asshole bestfriends pussy owner beat,1
happy birthday bird,2
gon take hoe gon let come spend money themlisten,1
think got accept fact bitch gon hoe til around age life lot easier,1
nah talk hoe since dont wan text back shit,1
kevin hart bitch,1
dear inconsiderate ghetto fuck train across know phone option speaker phone right,1
trash,2
well damn make single mother finally get pussy garbage,1
matter proud little as old southern bitch hang baby,1
like bitch,1
holy fuck frozen pussy crazy,1
like cant nigga thinkin hotep talk time apart party set,1
delivering bitch boy anymore,1
uncle tom mother fucking want invoke man speech dude aint white matter much,1
soon left iraq towel head think fucking barge take worked hard set piss,0
like bitch ernest somebody,1
bout beback old shit miss hoe texting saying wan come see,1
please stop scoring otherwise wont run tomorrow romero yankee bluejays mlb,2
somebody help bitch nigga bye want something say,1
could tried money feel better pussy ive ever,1
need insert chill pill as twice day bitch assness go away problem persists see doctor,1
vega bitch,1
cant trust every face bitch got watch,1
poor soul cuz fat bitch thing like,1
almost forgot posing old brawd wont get pussy needle dick beat lollollol,1
really tired constant bitch face,1
pussy mine,1
keep bitch leash,1
would probably still feel bad werent bitch,1
cheer stupid bitch,1
bros ovum hoe wifey come bros,1
oregon choke every year get field trash as program rft,1
could get matching burner phone ghetto fab month,2
niggah,1
bitch get punched lol,1
yellow,2
remember people bood one direction gaga none love bitch,1
grow bitch,1
bitch ungrateful,1
amish bitch rockin gucci man smokin ecig smh fake as amish as bish,1
show love everybody joe time hate stuck people thats hoe shit,1
used chase hoe dollarigns,1
try pas get carpool passing he looking like playing game waved idgaf dont fuck bitch,1
jiggaboo,0
think biggie saw kandi burress today would change mind fuxing one ugly xscape bitch,1
shes aint bitch shes tired bullshit attitude towards based upon treat,1
momma didnt raise sukka bitch,1
schooling bitch since,1
hoe dying attention,1
craziest bitch got best pussy,1
somehow didnt already nig,1
letting whats going happen like pussy as nigga plano,1
take bitch houston better speak another nigga meal still digestive system,1
bitch official though dick harder missile,1
know thats trash,2
pussy aint coochie since,1
gon ghetto color stain sharpie ctfu,2
dis wu offered help faggot as nigga get custody kid lowkey heated,1
dont get bitch take care mo overrated album released last year,1
pissed bitch dick shit dick soft cause way carry got ticked aint tryin rick ross,1
seriously reading thriller like book spook horror movie bookgeek,2
lmfaoo lmfao lmao nigger move sooo fast,1
white pie well negro pie,0
life bitch every dog day,1
wild one bronx yankee score run bottom take lead red sox halfinning took thirty,2
food goodexcept rice cook bitch monday week tootsies,2
top notch bitch,1
youre public side hoe,1
fed real hoe boy,1
wish tonight purge get hunting shut hoe as,1
he eating cuz he woman cant cook got get rid hoe,1
trey songz sing cant actually right good song trey songz relevant thirsty black bitch,1
cant even find mock anymore scary mass ignorance terrifying yes ala agree,2
dont ask feeling cause aint bitch dont got sad fucking feeling,1
lol bitch act hard stay getting as beat,1
riding ooo bitch nasty,1
dutch farmer white trash,0
remember yankee boston crowd cheering usa instead yankee suck love baseba,2
nigga gossip like hoe man aint wid shit,1
lil wayne said give bitch heart rather purse,1
already school fuck hate hope trip stage graduation hoe,1
happy birthday main bitch ride die girlfriend love much,1
want get brownie stuck doe,2
white boy power bitch black power bitch,1
ford ford fancy name fag mobile,1
brackin bity boolin wit sum bitch straight bleedin,1
wan cut hair busy bitch,1
bitch boy,1
bitch actin like celebrity,1
wondering answering wondering money nigga act like bitch day,1
ion put shit pas bitch,1
god forbid actually voted give people affordable insurance rate bitch teabag,1
text mean safe come eat pussy reach cream filling,1
cant put anything past new york bitch detroit bitch chicago bitch,1
follow nicca imyungjay,1
somebody who much moron pussy doesnt belong force,1
hate bitch bad eyebrow,1
ralph lauren jacket come tomorrow giving free hug bitch know high quality fabric feel like,1
milk marie got pretty pussy call pink cause nigga fell love,1
someone household want die get excited enjoy couple oreo someone left one one friggin oreo,2
huntin hard finally nailed best wedding koozie ive ever seen redneck,2
ahhh fuck let row hoe,1
jen bitch daquan dropped kid today keisha bitch dont got kid jen bitch swallowed,1
busy tell hoe played side busy,1
he clue heeb,1
well doe thank,1
gunna eat pussy diet,1
mets fan tried telling rivera isnt best yankee time closer wtf,2
find turtle find hoe,1
chase really got hoe every state crazy name truth,1
yeah one called race traitor lol,2
stupid people talking smack uncle tim tom ghetto fool wno future surprised ignorant niggaz even read write,1
wasp egg,2
bitch legal ridin round like rambo,1
lmfaoooo thats fag shit man,1
done top done sipped juice said bird crumb never,2
let hoe make much,1
sings killed pussy died eye open,1
happy hangover bloomington btown iubb indiana hoosierdaddy hoosiernation hoosier resurrection complete ncaa big,2
youre pussy shut,1
serious bro lol early bird special,2
imma limit association grade bitch next year life gone ppl dont got time frfr,1
fucked freak hoe tell posed homeboy pillow talking fukniccas,1
happy birthday bitch,1
haha shocked barca got yellow card time,2
get bitch house,1
negro keep adding baby fat got older,1
joseline audience mad bitch,1
refuse raise child bitch as country,1
hoe,1
going view point seeing star child monkey,2
ill beat pussy thats hook right thur,1
youre jealous bitch,1
leave nicca traumatized,1
wish never met bitch bro god,1
mlk march tryna find man bitch see,1
know niggaz bitch,1
tell nigga aint purple bitch nigga black,1
killed hoe though,1
ball life bitch bench life,1
freshmanadvice aint hoe get traphouseeeeeeee,1
shit hoe post instagram,1
bitch thats nigga well aint bitch,1
every frat gay brother pull hella fine bitch party sigma alpha epsilon,1
lol got rose dat nicca tho never forgetlol yee trippin,1
take shot wit chaser get bitch dont chase,1
steal shes hoe,1
fuck bitch queen get time,1
kinda want spit gum bitch hair,1
want pussy bad,1
nat def shiner,2
theyre playing charlie strongs soft dont run score mentality theyre playing guy,2
whatchu sayin hoe know man hoe,2
hoe cry mugshot bruh,1
ill give tip beware ugly bird hide behind massive lensed sunnies,2
smh retarded lol,1
go yankee candle buy beer scented candle go home light wait boyfriend,2
think nigga wit money dont even care swag rockin sandal wit velcor strap aint checkin bitch,1
try chainz heard big booty hoe,1
subtweeting sister hoe,1
bitch cute mouth closed smile fuck yall bye teeth,1
bet john elway get way pussy john dorsey,1
drug giant losing ask barrybonds hedge bet fund worldseriesgame faggot,2
jammer said thought mustard beat saying abdullah beat whole time loooooool,1
dont broke hoe hating paid hoepimpchampaign,1
girl curled ball bed waiting goodnight text sleep bitch,1
henny cup ice bitch froze,1
hate girl like cant talk got many hoe bitch competitive spirit,1
lol bitch run band know dumbi hate broke bitch hate,1
fuck main hoe claimin mob hav brake heart wen rob inda daark,1
breaking japanese ace masahiro tanaka sign yankee seven year million via fox sport,2
bitch hallon,1
photo check background spook,2
yeah bitch,1
he good football playerbut still act like nig,1
yall ever normal day mind play horrible trick give whiff good pussy,1
sarah burke pussy like,1
damn fuck bitch guess,1
kirk aint nothing bitch lovehiphop,1
either gun sandwich detail looking really fuzzy right dont trust police department,2
cant take girl serious refers bitch guy date nigga,1
pornhub get gaming stream feature dumb bitch gtfo get katie,1
fag dont tweet lol,1
stacey dash baddest bitch evaaaa,0
ready tell bitch shut fuck lol,1
damn makin bitch jealous reality twitterfacebook prolly mad pic posted wouldnt taken joke,1
stupid hoe wack,1
yeah right queer piece as youve ever got finger broke thru toilet paper,1
get girl point seems colored people died holocaust thats picture holocaust idk,2
doesnt like stupid bitch like vag idiot haha goingtogethurtagain,1
pussy,1
lol hell dey think nicca der roadrunnin,1
isnt murica charlie brown rejectedpeanutsspecials,2
skippin spanish class rest week fuck dat bitch,1
nigga talk shit period aint nun new white bitch threw every damn day,1
international police operation disrupts shylock banking trojan computerworld guardianinternational poli,2
boy retard sometimes time,1
used picture coming wadi fob sharana barrel brandy,2
white trash watch hockey,1
cant tell broke bitch nothin,1
talk hoe,1
got nugget time bitch couldntbehappier,1
everyone staring like whats bitch,1
elizabeth astupid hoe,0
call woman bitch get,1
tall big booty bitch wtf lol,1
thats call lol beyond ghetto smh man needa quit playin come back,1
simply cani deal confrontation back away cunt get nasty towards changed lot past year tbh,1
say act different think bad bitch naw babe thought miss,1
superman eyyyy,1
aint bout listen nigga rap eating pussy,1
woke feeling like bitch gon stop acting like bitch weak shit focus time bruh,1
nigga know hacky sack hoe nah throw look pass lmao,1
slap bitch,1
hear bundy redneck someone show nigga play,1
never thought could irritate like please stop fucking bitch surprised boyfriend put stupidspecs,1
lem cheer bitch,1
evan buy polo eat pussy till receipt expire,1
guess rube doesnt want date,2
johnny football trash man trash lol,2
awkward moment hold door someone use door next like bitch better back fuck,1
momma sister goodbye bitch time,1
something like perfectionist even check horoscope bitch,1
dumb haitian fake black faggot haiti neck,0
hey rachel name isint kenneth let get straight best backing ghetto,2
happy birthday dirty little bird tear,2
fuck summer bitch,1
heard wit bitch everybodyyyyy fuckingggggg,1
tryna turn bitch,1
lol naw bitch sociopath,1
alibaba jack got love guy beat meg whitman albino as back freakin commie genius,1
punk bitch walking tall like got something prove,1
know fuck bitch didnt react girl,1
say fuck nigga bitch need,1
bae sound like ghetto word use something else,2
eagle fan always annoying faggot,1
ram finna smack steven wackson bitch as,1
colt mccoy win hookem he still trash,2
would followed george washington mean youre white trash,0
one rawest niccas doin dis shit,1
shy girl cute,2
bitch chose aint pimp fairy rippimpc,1
