tweet_cleaned,class
merry christmas yall bitch hoe,1
holy fuck bomb as bitch bucees,1
bitch get stuff done,1
bitch got flameeee,1
umm home raising kid retarded,1
dont blame blame bitch cant help want nigga,1
bitch betta haha care love,1
never said wanted fuck tranny,1
feel bad bitch never disney world,1
see feel betrayed racism come shocked didnt call uncle tom bitter loser,2
moor used give kid free lunch bronx kid glad see still good,2
bitch called missing dick,1
yall confused day somebody put hoe dress,1
home bitch,1
everybody dot moboredmickey factz battled clip wore ancient hong kong shit different colored hitops,1
charlie strong got man roster nearly quickly texan,2
aint trippen done dropped knocked owe could neva foo hoe put,1
quick game sox yankshope get home soon,2
hannah retarded dont listen,1
kfc biscuit trash,2
sick tired faggot cage trying see long moses kill royal worldseries barrybonds joke,1
sweetest bitch youll ever meet,1
cant bitch future goal love kid youre parent first cant deal,1
faggot,0
drawing organic powdered goat milk bath rose petal chopped clam eww kidding bubbl,2
open starburst candy get yellow lmao bruh,2
kobe dwight soft muthafucka bitch as nigga lmaooo,1
talking fucking right pussy,1
aint get trap hooouseee,1
love hoe,1
got baseball well couple day till legend retired core yankee,2
niggah waiting weekend take shit,1
fuck wrong cant call urself man call girl bitch fuckin loser bro,1
thisty hoe,1
one day nigga gone learn fuck ugly bitch pregnancy need stopped,1
life short salty get pussy happy,1
luck bitch gon drug wont even kno happened lmao,1
getting field ready today game,2
holy fuck thank hate bitch fuck boyfriend back back like damn call peace pipe,1
birthday wish many big booty hoe mane shit ima turn birthday,1
lmao lmao youll never vega faggot punk bitch,1
appropriately guy wear yellow rick james face,2
ghettoblack,2
know samklef said wasnt lie man guy think beast naija pop music trash wizkid,2
bruh sasuke sakuras daughter gon bad uchiha bitch,1
hoe getting outta hand,1
nigga actin like bitch,1
fuck olive bitch,1
coon monkey like disgust minstrel show negro cry shit time youre disgrace everywhere,0
biebs getting fucked right pussy,1
ppl dumb hard curse like shitting cunt like dam cunt cant shit,1
got bitch tip toeing hardwood floor,1
hollywood nig brought twitter bounced,1
really whats concerning right looking forwd speaking john kerry tomorrow abo,2
yall forget brand new baby girl home bitch cooky burning,1
lol love little bitch,1
would def call dwight cradle robbing faggot kobe,1
like youre bitch bitch cuz got flower emojis tweet doesnt mean youre som,1
pink nipple cute looking nasty bitch,1
rick james bitch show titty,1
fat bitch thick,1
nigga talk bitch day,1
dont ever afraid double bitch ppl always expect like sorry got loud sorry,1
town movie friend stabbed nig time got sent prison justice,0
boy bitch lame dont nobody know,1
aint trippen cause like anyways got niggah got girl anyways yea anyways,1
ion care wrong bitch dont blow horn,1
face make see hoe trying preach twitter,1
really baggin bitch problem basketball short dont know smile cologne maybe swag idk,1
everybody getting fuck right pussy sayin,1
showing fairy blocked,2
freshman ghetto lmao,1
crazy wayne rap pussy song row,1
people time aryan race stand say mongerls turn world ghetto slum,0
look bitch suck dick real street nicca aint wit dat sucka shit,1
fuuck jalens slow bitch,0
every bitch as instagram bio like deleted booking email backpagepussycom,1
dem hoe nigga fucking retired widow new race fuck black woman,1
bitch yell step tell dont eat damn chicken,1
neck,1
hung dude wasnt fuckin bitch,1
good morning twitter make today positive one cant beat many meaniefaces possible also hate flappy bird,2
calm little asian lol flip bitch,1
indigenouspeoplesday right redskin lot queen right nomg sofunny,2
nigga straight gentleman speaks bitch come funky as attitude gentleman shit go window,1
well damn sure aint putting pussy as romo jersey,1
aint finna sleep bitch oclock finish noddin meet top,1
know pussy as coward weaker smaller like,1
isnt ebola type soup naw nigga country bitch ebolian,1
pornandroidiphoneipadsexxxx desi spicy oriental paki brunette suck,1
tweeted man telling kitchen season could tell mom father probably wouldnt leftbitch,1
club good lookin bitch gold teeth tho confused smh,1
niccas want war give got wethelastonesleft umightnotgetin beerandtacos,1
lol gon fun got two niglets way,1
liked one bitch always shit causing fucking drama,1
studying bio test like hoe,1
point ive got make tough life decision ice black translucent sole solid black sole vi blk orange airbag,2
spot open take better grab another bitch determined beautiful enough,1
shut bitch everyones perfect way,1
bitch look white,1
fight club new orleans bitch start jumping,1
fuckin hot gym pussy fuck yeah,1
hear bird chirpin,2
twitter even lmao hoe wack,1
republican governor missouri say he sorry called law angloamerican law racist pig,2
hoe fake gay,1
going full retard right smh,1
still hate bitch dmv californiadmv miserable hoe,1
aint nothing cut bitch,1
hoe love,1
nevermind found trash,2
dirty hoe,1
wish would stop hoe,1
timeline look thirsty basic hoe keep talking bout nigga dont matter ctfuu,1
yall bitch havin stretch mark yall upper as,1
undesirable bitch big bruh,1
watch black whiggers cry,1
bitch,1
people tailgate pas look lol wave like bitch yeah see care fuck pas,1
damn girl pussy talkin keeled nigga,1
ima pull eat pussy dip,1
going california today analyzer training going dick whitman mode wish tan colored suit wear flight,2
bad he faggot,1
swear care everything else bitch,1
ion understanding hoe drop yall nut bitch as cant hear mouse piss,1
girl know got hoe,1
disco used disaster recovery awesome brownie point well built extreme condition,2
slaw as team time start dat bitch ovum,1
maybe want friend maybe shes stupid bitch never know make cum,1
gook boy shawty,2
space brownie,2
nigga loose bitch bitch snitch,1
rather believe man definition good mock,2
ill get much pussy,1
bitch freak fucked sleep dat last time slept shit woke fucked aint sleep long,1
racial minority werent criminally inclined wouldnt much worry act color race traitor,0
biggest booth ever seen lastnight bitch leopard print jumper look like weight leopard,1
babe thought countsbitch thot,1
fucked fucking retard condemning ray rice yet supporting chris brown who woman abuser thats logical,1
trash wanted fuck dorsey,1
hurry nigga last key dont know fiberglass safe get bitch need glass key,1
pissed forgot saiyan bitch infio gave tioo fuck,1
dont shit talk chip talk dese niggaz jus bitch talk dese niggaz jus chik stalk naw aint got chik,1
come somebody please get willing eat pussy need,1
lol still lil bitch,1
retarded as movie netflix,1
cant colored white folk get along cept colored men gots bigga dick,1
got bitch as coworkers stay late every day last week dont complain mf stay late send email left,1
ive got saltine cracker red wine possible diy communion havent church awhile tbtweets,2
haha bitch,1
yep assholeoh well shouldnt little bitchim sure hears worse daily basis,1
need as whipped whip house nigger remember always nigger,1
finna see yankee win baseball game,2
bad bitch,1
hate shit dont mean nothing bitch feeling,1
pornandroidiphoneipadsexxxx xxx homemade pussy eating,1
never worried next bitch always worryin next meal tryna fuckin eat fuck talkin bout,1
lol bitch act like single post picture nigga hahaha,1
hoe,1
condom invent sole purpose,2
aint met bitch yet could compete,1
yea listen hoe wake,1
bitch as nigga square,1
dream job pedophile dressing like mickey mouse hugging kid day,1
unfollow bitch wont cry,1
like said fuck lebron fan base bandwagon dick rider loyal as eater dont like bitch nigga love one,1
shoutout everybody follow nicca,1
bae talk hoe,1
good fat dyke,0
tranny,2
sometimes need moment appreciate noble guinea pig steampunk dragon wing,2
curve outta hoe,1
tia chepa uhh noo bitch tia irma aghh he annoying,1
chris bosh made danny green bitch last night,1
bitch youre ugliest cunt ever,0
might fuck main bitch dat feel,1
stalk bfs insta follow girl flirt scare bitch,1
many shady bitch secret thirst alive,1
femalelogic worse jig convinced,2
would look feather instead fur would able eat bird feeder without getting judging gla,2
nah bitch apple apple apple bitch nawl cuz orange orange orange bitch dumb fuck,1
gonn comment cause closet hoe lol team getchoassoutdatcloset lol,1
hell blk stop sayin nigger america,0
aint buying pussy got many follower,1
hate bitch like love much,1
alarm set early bird night,2
bitch love miley cyrus rihanna cuz speak every girl inner hoe,1
real bitch really hungry wont arguing bitch twitter straight flexin,1
cant tell last time seen niggaz fight see bitch fight video daily,1
hoe aint worth losing sleep,1
beat pussy,1
lmfaooo like bitch alanah serious,1
tell bitch followback rts saying followback doesnt followback blocked like fuck,1
lowkey youre still bitch,1
would want play pussy dead snl,1
bos nigga fuk wit bos bitch vice versa,1
pac real temptation thats exactly nigga getting money bitch,1
ayy might well get fat hoe dont even like ab nomo like balla belly,1
scientifically proven one cry least watching charlie cloud,2
mitt romney hate big bird fascist,2
word doe good morningits celebration bitch,1
lmaooo black fag misread blocking,1
ive talked much trash lose today,2
everybody claim fvck bad bitch ugly bitch getting pregnant somebody lien,1
dont trust hoe never trust hoe,1
ugh tebow youre officially fag followed,1
inhale white exhale nigger,1
wish bitch would,1
den enjoy nite wit colored man week let need bring magnum,1
got new fish albino named shaquita yee bahaha,2
girl say like ohh ugly like bitch aint fishing compliment youre like deep sea diving fuck,1
openly admit level white trash drive across town gas station free hot dog half price drink,2
cowboy killer,2
men interrupt woman quibble irrelevant issue sole purpose derailing conversation,2
international police operation disrupts shylock banking trojan computerworld guardianinternational poli,2
opinion lhha spot description atlanta dumb hoe nigga ratchet broad stupid argument,1
dont pay dem bitch dirty as chuck mind bro,1
throw flag bitch aint real bush,1
one big lecture hall full bitch sequin limited tank top,1
want expose bitch,1
hoe got complain life like hitting right,1
annoying yelling bint next door locked,2
unfollowed another crazy bitch who next lol,1
worried bout bitch,1
bet hit bitch like game winner,1
woman bird turned woman sky nigeria,2
wake american sheeple stop allowing pussy azz politician never bust gun,1
thought playin cut bitch,1
bitch lol cute tho wassup gimmi numba imma natural lmfaoo,1
found arm trash receptacle leg mud streamyou consider keeping better track limb,2
probably fucked bitch homie,1
whenever need hoe protected social medium anywhere world please contact hell fight hoe,1
ginobli dropping bitch like delta line,1
drake said best said nigga act like bitch day,1
allergic bullshit fuck boy basic bitch,1
kim hoe fucked dude see hoe fucked dude dont even got,1
shiddd add turn bitch lmao,1
people house bitch,1
time studio make really good music act like dont know bitch flexed since,1
yawl chick love side bitch bitch day dream aspiration step mom,1
tell chickfila cashier thank bitch dont say pleasure,1
ayo take pic fam think bitch gon fuck pic lma,1
demand everyones money object collectively redistributed among supporter,2
hate whole slut hoe thot talk lol given sure people personal inboxes late night look like,1
laughing joke big different bitch,1
got shit bird blessed,1
river seriously bitch dont throw hand around like year old something didnt right lol,1
well ontario like kind dump ghetto moved since cheaper live,2
first day school backpack paper book granola bar brownie bag cooky,2
aint killa dont push revenge sweetest joy next gettin pussy,1
hoe sooooo ugly like bitch ugly dog like dumb stupid as ugly like,1
someone push hard today may surprised capricorn,2
kick wit yall check squad buster blameamotherfucker as bitch surround twice,1
hitman holla charlie clip matchup bittersweet shit gon cold cu hitman holla gon work last battle,1
guy faggot,1
bitch flirt bae,1
fugly bitch john dump ratchet as,1
lmao omm see bitch tryna act like aint feel ahaha,1
fucking hoe nigga waka hate man,1
bout get bitch cell mate,1
chicago nigga tell bitch anything tryna dat mfa,1
theteabaggers like bald asshole complain long bill draw moron picture morningjoe,1
see part giant govt take stockboy joke representative dumb teabagger,1
cant real account dumb bitch wams fucking bitch,1
hoe,1
whoa sorry spell check error hey sorry,2
wyd fag,1
bitch,1
fucking muzzie edict come fed prov govts,1
fake as hoe around,1
tweeting tabletballer bitch,1
folk bad talk trash,1
nigga fight nba theyre called ghetto dont know act there brawl nascar nobody,1
brother fat hog man swear reason doesnt money anything right cause white hoe,1
bitch want next best thing,1
secondary playing like hoe,1
thanks hun crushed love working itll month gone time back,2
lol like selenas horny bitch lol,1
cant trust nigga come bitch,0
dblite work like charm openwrt arduino yun full test coverage gyp version would rarely made,2
swear newnan utility gettin nicca bout start reading damn meter,1
word pussy snack lady keep beer cont,1
white trash moron offended redskin team name liberalism,1
senator anchor baby back came natural born canadian,0
lose sweetyou aint lose hide lmfao viri tryna smoke hoe self,1
bitch dont turn crash,1
lit bitch thats talkin shit aint math class today really wanted press issue,1
elissa fake cunt,1
mickeyblowsyourmind want skype group bunch offensive new york city queer folk,1
dont love hoe,1
yeah troll annoying dont concern theyre twat life lol ignore,1
hit raw listening papoose,1
using fufu bitch,1
dont want thot thot girl cant get nofrom hanging little hoe wearing,1
white bitch win smh fucking hate,1
shit gettin money fuckin hoe dat lmaooooo,1
say pedophile promoting dolt lmao teabagger,1
happy birthday fag,1
kimball gym today boy carter kimball hoe wouldve stupid,1
mad cuz fucking enemy win cuz letting shit fuck cant control hoe stress,1
bitch think know snap bitch snap,1
said get bitch thats frohorsemen,1
ill take bitch make everybody bitch,1
current favorite line shea moisture target cv great dry curly andor colored hair,2
magic ball hoe loyal,1
bitch jail,1
wont bite promise he friendly bird,2
fat dyke make want vomit,0
bitch please trying say closer philly,1
wiz thought could turn hoe house wife shedontbelongtoyou shebelongstotheworld,1
he bitch,1
nigga catch cheating beat as front lil yeah lil yeah dont help still give pussy lady,1
lmfaoooo bitch dont start okay bitch,1
there one bae end day cause ride unlike bitch,1
dont end monkey hate better cracker love deep know weve done nothin,0
yeah tried bein blind shit lol peace bitch,1
never item psycho bitch,1
would love hit jig fucking life,1
suppose eat booty bitch wym,1
got trashy as hoe,1
miss scary hoe,1
bitch bought son talking bout get sold,1
spear chuckers flooding upton park,2
nicca hungry hell,1
noap taking maca root pill making vagina wop,2
ghetto girl pronounce name could cry right god,1
early morning beer reward waking taking trash,2
ike finna bitter bitch upsaught dont care lmao,1
wearing pajama tonight gook udigg grey day,2
shyt nigga tell hoe wan,1
rozayidgt mad cuz twan fuck bitch,1
oomf make skin itch like bitch,1
kinda figured lil bit said bitch cute,1
icanhashtaghoweveriwant bitch,1
charlie hatin fool scandal,1
torus better watchout hoesshes gon get caught,1
sick nigger,0
faggot as nigga cry people talk kick certainly make lot fucking shoe comment thats yall man smfh,1
hate cyrus rookie slut getting cash date nope nope nope,1
lmaoooo hell naw bro havent seen hoe,1
test today making pan brownie going lay bed day eat heart content,2
fuck bitch shrimp shorty midget dwarf infant,1
bitch think trucker hat automatically make model,1
foreign bad bitch said name trinaaa trap house look like got hit hurricane katrinaaaa,1
bird gone run as,1
asking kid brought apple teacher he queer,1
hoe gave head say turn,1
coon use effect picture,1
always pathetic mutt desperately seeking attention purpose matter writes never change,2
bitch fucking insane sentence describes word,1
work imma real uncle tom,2
ion speak flaw nigga thirsty hoe boyyyyyy look,0
know bitch mad like wcw,1
he asshole like neck problem cant sleep way lil bitch,1
part chink,1
got find new house land lord bitch getting waaaay better house good lol,1
today horoscope youre still hoe nice day,2
didnt know love coon as cuz,1
bad bitch pussy aquafina call crystalina,1
today charlie wilson left office ranked alongside lech wasa role defeating communism,2
dont even need picture tamar bitch beat every picture,1
queer gaywad,0
hate bitch cant take compliment youre pretty ugly well shit ugly damn,1
tell tho ifwhen nigger woman start getting cornrows againmannn dont,1
damn cold colored man,2
lightskin lmfaooo ight white bitch lol,1
great job yankee giving brian cashman new contract hater wrong,2
awe hell nah bad bitch come fuck,1
fucking hate ignorant as bitch,1
dont take advantage nice person hoe everyjuan,1
come yankee let keep game going must win,2
hoe live jus hit club every weekend,1
slow puddle youre bitch,1
bitch better play,1
ate oomf pussy,1
heartless as niggah isnt adays,1
grew hate blonde primary colored weave wouldnt stop requesting good mouthwork,2
ill write poem hoe,1
nigga dyke melo garbage as hitting,1
bitch,1
aint mad bitch thats hoe,1
eye brow finna fleekate fleek bitch,1
love eating pussy lol never get full lol eat shit forever lol ever,1
try crucify tweakin hoe,1
nigga fuck yah good eat pussy home bitch like aint shit happen,1
wallah dumb bitch dream fucking lottery wake early play fuck hoe,1
bet hoe,1
idgaf bitch say,1
dating scene wack dog shit super trash,1
guess bitch dont,1
jig levitating lousiville,2
bobby bitchhot nigga,1
dont forget got take trash need milkand spermicidal lube,2
lame bitch get fuck gay shit,1
roberto one nasty hoe,1
ima call different number cuz mom still sum hoe shit,1
freezing cold shit lel bird crazy,1
weres bitch boy,1
one stuck bitch,1
bitch youre bitch mom bitch bitch dad bitch fucking bitch who,1
bad bad bitch make late,1
doesnt take as tell bitch youll pas,1
tell business bitch cant trust,1
cant bomb single bitch available tap,1
face ugly nude trash,2
respect people cheat shit retarded,1
may dumb stump even sarah mock obama,2
bitch redbook account selfies add like bitch trick wan see face,1
get cold yall gon trash lol,2
smh tyga shoulda knew blacc chyna hoe son crip walked pussy,0
need bitch,1
drop pussy bitchhhhhhh,1
tight circle bitch cant get thru dis loop,1
beautiful woman havin retarded caption pic sht extra dumb,1
aint getting hoe come back room staying circus circus bruh,1
fucking money bitch,1
cant bitch living say brought michael kor need guy like,1
fuckin moulinyan,1
official leave america january see bitch february fun winter,1
ghetto girl best bet find work call center try climb corporate latter,2
pull make bitch mad,1
shine hoe,1
homo sorry cant straight like pull mad bitch,1
made put basketball short look like confused dyke mosh warrior,1
person big booty bitch,1
music sound million time better car love sub new speaker like mini rave bitch bumpin,1
come get catfish pussy,1
favorite time day happy hour drinkbreakwhen bad bitch come hoe home makeup,1
lol never understood retard use atm pay fee get put gas dont pay credit price,1
uhuh empty heart empty bottle yellow cab would like catch cuz latest made mad,1
youre male hoeshos andor bitch default word womenyou got remove please,1
teairri marie crazythe poor girl aint anything herbitter as bird,1
nigga fuckin faggot,0
bae juss new side bitch lingo aint special hoe,1
bitch nigga shit invented created term,1
stressed backwards dessert thats bitch eat junk food depressed,1
well damn side hoe claim boyfriend,1
wonder sue bitch wasting time,1
know feeli never thought see sox win lifetime hope use ant yankee hook see game,2
girl think bitch attitude attractive made think,1
welp prettier bitch usually loses lol science,1
dreamgirl mckee ooh bet wooonnnttt stick dat hoe,1
fuck better laminate face youre grown man think eating pussy emasculating,1
got carburetor foyer chevy rebuilt redneck friend everybodys got one need build,1
seen dude wearing black white outfit pyrex short shes getting pussy tonight,1
remember standard becomes cool againim gon call lot staying quiet like bitch time,1
basically become fearless bitch mad,1
diet coke trash,2
chava need stay lane keep sending gyro hell dont want big boy dirt infest as beaner,0
fuckkn hate fight big pussy time,1
let fuck side hoe peace smh wish boyfriend would respond text,1
lmao harden look like last air bender bitch,1
sick watching yankee game,2
dick want pussy,1
king fire king tip troubleman album trash def,1
bitch done blew high,1
youre safe pussy boy looooool,0
every bitch love bank account overdraft,1
pussy let wheelin,1
almost got fight southwest faggot carnival lol,1
one niggah grab aux cord start playen weak as music,1
car two registration tag yellow one one wth,2
grand opening top class oriental massage perfect,2
real fan wait want put trash like rapper signedtothestreets igo,2
never leave trust bitch,1
smh play dreamcast hate playing someone home trash as default broadcast cam camera goat,1
adult human skull found trash,2
lmao even bro girl thottie keep simple call hoe,1
idc still get thats pussy,1
eat pussy like cold pizza,1
twitter whats mean come alive night time sleep day hoe night,1
got dawg norris blue flame bday dat bitch couldnt even drink pop alcoholic as downed,1
rickie shitstache rest pussy better enjoy back injury nothing birdie putt,1
waiting take get nip pierced,2
car wet bitch wet drive car pool,1
ran house kinda retarded lol,1
sorry dyslexia bitch,1
peep got mad ghetto nowadays smh pull pant,2
beany cumming real soon,2
best collegegameday sign ever dakness spreading charlie murphy true hollywood story chappelleshow,2
bitch always think somebody want little coochie lol chilling dont exist nomore iont want yall hoe,1
cant stand faggot,0
stayin late watch ichiro yankee,2
gahdamn got bitch damn got bitch damn got bitch wifey girlfriend mistress,1
youll still fag ill pas heidi,1
come home work bridesmaid twinkie bottle wine bestroommateever,2
watch woman try argue like dick actually fucked pussy hate bitch,1
peyton mannings remarkable season pas yds nfl record pas nfl record completion likely,2
smoke bitch,1
many bitch enough adult,1
atlanta min got bad hoe number,1
bro next year ill make look like straight trash enjoy little time left,1
need know pussy like one time fine drizzy lol,1
put ona bitch make bang set gave hoe dick came left,1
shes wearing shirt bitch,1
god damn bitch smh run away,1
new year resolution smoke weed make money fuck bitch,1
happy monday bitch wanted know yes dont ever fucking forget amazing strong,1
jayz got baddest eva prof men dont really need look good pull hoe want security,1
wtf bitch broke arm eery time hit shit,1
quit hoggin blunt bitch,1
keep shape ski slope,2
feel like entertaining hoe fall back even harder,1
man wilson black win chip talkn trash talk shine russell,2
forgive hoesgirls,1
bitch mad man cheated cheated mad,1
couldnt mama joyce wedding grumpy as bitch,1
naah twitter bird,2
obama always necessary protect american people defend evolving threat,2
dont even entertain hoe got somebody important,1
whatever hoe,1
rolling deep even got bitch running,1
bae talk hoe,1
twitter nigga care bout hairy pussy nigga fucked today aint,1
idk skinny bitch think got as cuh,1
bro hoe live,1
magellan suck trash talk,2
man wish big booty bytches would use nickname judy shy typical old,1
spent whole lookin hoe missed firework realized didnt hoe allbad,1
married white woman lucky sumbitch uncle ruckus,1
run baldhead bitch thing,1
mace wife charlie brown rejectedpeanutsspecials,2
anybody team permission fuck bitch,1
going talk shit another state thats dat pussy shit,1
niggah tripping everybody,1
tyler make think theyre lil nigger baby hoodrats,0
dont mean crowd crow,2
sup fat bitch,1
wonder girl call eachotha bitch cool nigga call dem one mfa body dontgetit,1
pornandroidiphoneipadsexxxx smalltits small tit ghetto whore fucking stepdad,1
excited white trash bash party tonight,1
prolly sum hoe tryna get hurricane free sent nigga twitter tho,1
sure wish nose would stop drippingthis sick shit bird,1
real nigga know matter hungry better let bitch cool,1
gasoline daddy yankee,2
wish wish wish wish wish wish bitch would cept already gon handle,1
take one bitch open mouth nigga start fuckin,1
today talk like pirate day absolutely nobody knew charlie morton impersonation day,2
sleep bitch,1
future gay culture considered cool america teen instead wiggers straggots,0
rihanna must got holy grail pussy,1
omg nip,1
kissin small lip trash lol yessssss,2
string bitch,1
really hoe shyt know hoe,1
think america crooked lawswomen country get executed street shoningyou american hoe wouldnt make,1
hoe as nigga,0
black girl hoe cause fuck nigga money revenge dumb shit like,1
last hour getting stomach tattooed felt like going puke god damnit pussy,1
yall know skip bayless slit wrist romo lol,2
people jury selection retarded,1
