tweet_cleaned,class
middle eastern indonesian woman beautiful never seen ugly bitch bollywood film ever,1
five thing ill never give bitch heart weed money twitter netflix password,1
rap bitch prolly scared remy lol,1
time hoe,1
reggie give headache niggah,1
still trash,1
yall hoe instagram rate,1
yall aint gots colored folk show tinks dat racist shit thetoddshow,1
hate playa yankee hate yankee payroll hate dodger,2
tell girl calm shell act like kicked pussy,1
naawww though yall hoe dont fucking play wme,1
well bitch biology said said female cant make baby together thats,1
uturns yellow aceptar este luz rojo light taking long make bilingual,2
doggpound never left hip hop fan turned hoe literally ratchet broad pretend like baske,1
back hoe tho,1
delete lmao bruno mar debarge cop blow niccabut dont mind tho,1
people comment status like day like bitch wtf know,1
bitch betta get rightshout outddaaawwgggffaaaccee cccaalldddeerooonndese hoe aktin,1
jadeveon clowney top latest mock draft he every year guy,2
really hate bitch people point longer give fuck,1
nigga seen as welfare center punk bitch aint worth time,1
thru dat pussy never caught asking got much mileage,1
dad bitch,1
another bad bitch fuck hour another cigarette another nut another shower,1
watch baseball actually mets jon stewart fuck yankee,1
wish bitch would straight wit friend tell look ugly really say cute smh,1
shut bitch,1
actually hate bitch,1
told wanted get gift would take breath away got bitch treadmill,1
aint gon take pic tho scared japanese steakhouse tho bitch walking quick,1
smack peckerwood judge pit,1
dear ugly hoe stop playing hard get youre already hard want,1
shit hear might true might faker bitch told,1
sex date dont mean hoe waiting day wont make wife cute pic dont mean yall happy title,1
song ion kno referred future wife bitch,1
naw keep fake get lame as somwhere wigga hell get somwhere,1
seen hoe put cash bitch imma take money spit fat as,1
better feel love dont even show hoe love lol,1
look like fat kid charlie walker got stuck chocolate tube,2
white bitch facebook lol,1
lyin as bitch,1
get pick actress portrays unsolved mystery police find remains bitch,1
let bitch try try ima swing whole family,1
actually get erin think shes really nice bit youre two faced bitch time nasty,1
like bitch wit as aint shit,1
he trash tho million naira want song wizkid via,2
killt dat bitch shmoney bitch,1
thats right making brownie right,2
want thingamabob got twenty bitch,1
mom wasis hoe shes likely hoe think learned,1
cause bitch rather eat pussy get mine ate,1
remember playing halo episode pussy finished chapter without fuck,1
damn called bitch bruh lol,1
fuck wnba fuck dyke set gotnoset,1
still feeling new pussy,1
would drink nigguh smoke weed,1
whoooooaaa chill savage monkey monkey,2
bout beat case like pussy nigga,1
harry must thincc bitch fall bacc sum boi byeeeee,1
eminem said call faggot cause hate pussy,1
thanks cracker tweet today pilchard krackerwheat repeating like typical night bbc,2
hate hashtag activism lie think trash,2
principal shld ashamed look poor colored kid made smart prop disgusted morningjoe,2
fucking first night dont make hoe,1
part cousin dannys yankee swap pretty hilarious clever danny,2
famous woman biggest hoe,1
yall hoe dont need valentine yall need jesus,1
fat bitch who fat think thick big fine,1
aye needa keep head high care lost went tried best south bunch trash talking pussy,1
lil bitch vet say need dog,1
bitch please ill windsor either way come bring also,1
let hoe tell man,1
guy said wearing legging laughed called fag theyre jeggings asshole,1
fucked tyga bitch god,1
know lil bitch runn mouth street,1
wanted let everyone know downloaded whole acoustic justin bieber album fag,1
rat family dont get trouble youre little bitch bloodthickerthanwater,1
rihannas favorite thing white house visit president black solidarity poking whiteynot wise,1
soul mate probably around corner,1
support killing terrorist yes still mock hypocrite hell yes,1
justice british seagull spraypainted red thug bird wont able fly anymore,2
yankee red sox scoreless play inning bambino watching,2
dont forget nikko digging booty sex tape gave head bigger pussy,1
bitch lot coo,1
make pussy making stupid internet threat youre child idk probably deserved,1
anytime girl asks help tell bitch ask channing tatum since thats mcm,1
scared herher pussy good lol,1
done everything hoe ever wanted daddy nigga money,1
except used super tan yellowpale lol,2
cheating good woman like eating trash instead going steak truth,2
bitch look wen hear song club,1
lem guess wore hilly hick sweatsleggings,2
still greatest tweet ever bitch run emotion logic bitch say number,1
bitch hoe check dm get new follower,1
exactly tweet shit fuck dont like everybody aint monkey see monkey koiya,1
girlfriend fasho pussy pussy dont lose fasho pussy tryna get pussy end,1
young attractive successful supportive faithful man everythingu think bringing solely pussy table,1
wan michael sam bitch bad,1
cousin looking bitch hope fuck,1
bitch cant touch,1
pussy worth,1
like bitch green eyed curly haired kid talking future child,1
lol crew actual hoe,1
tell bubba alabama youre african black he gon call nigger extra hard,1
hot press here todd mcshays first postcombine nfl mock draft including new,2
text new bitch pussy wetter,1
fuckin pussy make fun people day radio someone call creep block,1
fuck bitch get money favorite nigga line girl leave as another man,1
degenerateartist isnt bitch walk back word isnt witch question turd glitch evolves absurd,1
update collegian dressed yellow teletubby face charge breakin theft chinese food leftover,2
one man trash another man treasure believe,2
rule number two dont trust nobody especially bitch hooker body,1
aint fuckin wit nomore hoe got want,1
based god fucked bitch,1
wonder ppl call nigga thug able convince hoe false idea men like intellectual dress,1
working fag,1
jealous bitch,1
hope accidentally get fat black bitch pregnant,1
saying though panty ion look like bitch tho,1
bitch love soda,1
faggot guess got caught saying nigga,1
actually gon train fag dont dare bring boy house slutyou scissor like good girl,1
jus wan let know okc trash ibaka aint shit yall aint goin nowhere without harden,1
got good mojo sure payback bitch,1
bae mean anyone else ive thinking ghetto word babebaby,2
early bird get worm gogetit,2
hoe dont give fuck got girl,1
haha would fag color reserved,1
nah bad bitch,1
youre trash,2
decide damara make gladiola gorgeous rustcolored one coming,2
real nicca shit tho lol,1
davidpullsbitches tweetsomethingyougetalot talk hoe,1
dont understand people say yea first time smoking didnt get high cause damn fuckin suck bruh retarded high,1
lololol freddy still bird doppz still wet man harry still parry salting,2
laughing hard lay unloyalist ho plea,1
somewhere redneck jerking hand hell lose firework accident tomorrow,1
got problem bitch heard call bitch,1
one time girl asked problem instantly replied love bad bitch,1
flappy bird stress,2
thanks follow guy enjoying cold yellow belly right,2
dont unfollow got app bitch,1
dont frontin as bitch,1
new year ever get bitch loaded gfu,1
hope trash talk abt poor product doesnt hurt chance getting hired legal correspondent cnn,2
bitch say hahaha,1
slept good thenna bitch tho,1
youve got smelt lot manure sing like hillbilly hankwilliams,2
lmfao bitch got phone,1
bitch said look like type lot cocaine,1
pull make bitch mad,1
lol dumb bitch,1
aye nigga tryna freestyle trash though lol,1
rapper say twat make feel weird,2
side nigga get pussy main nigga get argument,1
hoe love pump fake bout yall life social network,2
man bouta text bitch ever told lmao,1
whats guy fat bitch clearly never understand,1
everybody already hit course nigga cant take seriously idk hoe surprised,1
yes bitch messyyy,1
guy number yankee look like uncle stevie lmao dying,2
god cant fucking stand waiter bitch people tipping get real fucking job,1
need hoe,1
hoe,1
bitch behind annoying,1
ohh bitch got fck girl second lil family frfr,1
high thenna bitch thats tweeting,1
bitch sad lookin like lack funny,1
drunk walk let drive got bitch night party dont start til drug arrive loaded,1
wonder hoe gon give halloween back child year,1
reason look like anthony davis eyebrow fuck nigger act different girl arounds,0
called basketball player fade twitter cuz dat pussy nigguh live georgia come get bitch,1
gon make chicken sandwich put half bottle tapatio bitch figure shit,1
cute teen get pussy flooded withcum,1
feel like gon homo revalution round dis bitch deez nigga expandin,1
spendin money saved stackin one like brick hittin bitch like craig watchin as clap morningstusesh aminfairview,1
bitch cant serious,1
let stretch pussy nahhh,1
niggah func fucccccccked upppppp,1
bull color scheme dull stupid bitch duke wear bold pastel color bull make sense,1
naw deez aint hoe gota add strup,1
never full retard,0
ians retarded,0
bitch youre white stfu shitty spanish,0
fucking hate lmao thank little dick van dyke,1
yall dumb as nigga pressed hoe yall weak fuck fuck weed hoe oreo,1
cute love yellow raincoat contrast thather hair look cute love face icon,2
know lh ghetto,1
leg dont rub together mean pwoosy trash heard,1
fuckin ignorant as nigga dont video counting money say stuck bitch,1
want lick one lucky healthy clean woman pussy tonight totally change life view men forever,1
said soul patch bitch lmaoooo,1
period dont stop nothing sentence boo let taste pussy bet taste like quarter,1
lol bitch staggering drunk,1
nigguhs glorifying pussy,1
damn dis bitch found baby dead shes gon torture murderer lmao fun,1
as perfect cant help yall dis hoe praise nicki minaj everyday dont understand nigga man,1
yeah better play nigger,0
girl needa stop edits damn near got catfished week two ago bitch keep findin way back,1
never game obsessed angry bird took long cc scared lol,2
hoe feel like photo didnt get enough favorite,1
love going looking gun wife talk spanish redneck stare reconsider,1
bird pooped,2
love bitch wit sum nice teeth lip,1
last time pussy salmon pink,1
dont touch bitch famous,1
wept thurmanmunson died weep year later captain yankee,2
hoe goin bitch thats hoe,1
whiny bitch kris left come lulu aint gettin shit,1
quit baby hit patchouli pussy,1
side bitch sunday,1
bitch awesome,1
trying take word bitch outta vocabulary hardest shit ever,1
cole fucking queer,1
pocket hella empty bitch steady choosing,1
dont nigga want artificial bitch let repeat one,1
aint bout wop,1
nigger,0
omg thinccin make laugh use stay talking shit period cute bitch,1
aint stevie bitch course youll call scum earthhis bitch hooked theyre upset though,1
barber bein able cut hair yesterday really prevented goin club gettin mad bitch owe free cut,1
bae said bitch watch yall mouth lmao,1
nigga made nigga made best rider go blaxican,1
people calling people hoe main one sucking dick chalupa worry bout,1
hey new follower waving welcome ion talking bout shyt tho retarded as thought pop head,1
going thru bitch aint even bitch let whole team hit,1
text instead playing flappy bird soiknowitsreal,2
long gon feed pussy get munchies,1
parent let drink underage theyre fucking retarded,1
unfortunate clothing choice hoe crooked belly ring completes dumb trash motif perfectly,1
drunk bout bitchneed ride,1
love sub cause mom start fucking bitch crank system simple solution,1
he friggin idiot say anything redneck teabagger constituants buy love stupid people,0
umm bitch hello alive clearly dobt,1
hate bitch know dont fuck really trying talk like cool nahh bitch foh dont,1
love faggot absolutely love especially one dress tea,1
dont want heart broken dont check nigga entertains hoe,0
thotgoals wan learn jigg really good circle,2
slut hoe neededrespect service,1
would know dont fuck exactly dont wtf got shut retarded as,0
tikiti rough mock base eventually ashtray tiki,2
photoshop putting head fag proof,1
whiteculture thinking weave ratchet ghetto extension perfectly fine,2
lmao brutal nigs cant get job lol,1
arguing ugly bitch twitter,1
rich homie bird man gone mansion lan tonight nigga got fuckd bouncer,1
punk pussy as bitch dude dont ball fight wan wan hit girl fuckin bitch,1
subtweeting little bitch taking high road,1
bird word esurancesave,2
doesnt kill make bitch,1
fish bitch,1
side hoe playing much want head,1
fight tubby bitch ill fight anyone,1
dont call nigguh unless call nigguh,1
hoe gone hoe,1
chippah hope aint hangin wit dis wigger boy,1
deadass wanted sauce till shit got real nigga wan back ooh iight smh pussy,1
literally scream throw bitch fit people dont hurry fuck,1
weezy bitch wheezy chronic cough,1
new nip dropped today rii,2
worried bout bitch cause know bitch could somewhere sucking dick ayeeee,1
ratchet broad dont represent white as cant talk trash cause racist shit black,1
lot tweet medium tonight election night food record cheese cracker,2
he going someone bitch bought catch hell cell block fuck men rapist child molester,1
cruisin round street jockin bitch slappin hoe,1
stood outside minute take phone call went back looked mirror saw somalian fuck sun lil punk as bitch,1
want take time tonight acknowledge hoe,1
pull eat pussy dip,1
cant wait till boyfriend break nigga act like pussy,1
dont concern wit mingling bitch,1
really get upset lightskin friend another cute dark skin sidekicklike supposed cute darkie hang wit,0
long beach california people automatically think ima badass bitch hahha,1
love fat bitch thats fucking problem,1
honestly hoodiest ratchet bitch asked prom dere,1
last tweet song lyric dont really like bad bitch like pretty chick bad bitch cheat easily often,1
sometimes feel like really nice everyone like wait youre bitch anyway soooo,1
woww nigga cant hit bitch line ask doin nomo,1
really fag gross aid infected sick fucker,0
mean hoe stupid ion want around youhavejustbeenblocked,1
gresham road soldier bouldercrest soldier told bitch quit cause never gone propose,1
brownie made sin,2
old bytches sorry phuck sack pussy get ripe,1
punk bitch,1
bitch make moan sex owns soul,1
street dirty hoe niggad try wife though,1
drop hoe wrong one got bring back lmfaooooooo,1
like chilling bitch like fucking,1
south central niggahs really dont lovin hoe hoe dont lovin niggahs,1
aint fucking feeding supporting opinion irrelevant bitch,1
andy went owning toy owning bitch also coke teaching class,1
great reply except trash,2
yeah six complete stadium yankee lead red sox letsgoyankees,2
ive seen every episode scrub ever sense first episode niggah,1
wan get money fuck model bitch russell simmons,1
never tell bitch love,1
dry humping hoe tonite bussin costume man deal wit later somebody girl gettin fucked tonight,1
ready get fried oreo,2
scheduled already tho bitch bryancranston one tweet he got joepesci making fun stolenbases baseball,1
like youve become inconsiderate bitch beyond done shitty attitude backup,1
certain niggaz even get bitch attention hey,1
fuck bad bitch stacy lattisaw nigga ball blue like avatar,1
lmfao shut slutty white hoe didnt know pat got destroyed tonight lmfaoooo,1
get monkey back,2
according brother ipod december predict mickey mantle yankee announce retirement march,2
need sum hoe sum cuz wake hella email goodmoring goodnight text shit even single text,1
good thing hoe aint hoe forever expiration date come,1
tennessee isnt even orange like vitamin pee yellow,2
isnt law clam chowder must served bread bowl haha,2
good girl worth hoe,1
cant stop lil bitch,1
bitch nobody wanting as assumed cuz let dog run filth think want itnot,1
wish parent bought car man people bitch getting car want want free,1
hoe control,1
go babe bitch love hate need fuck youre everything,1
call grow live long sorry parent poor skill got old bitch,1
dumbass like dumb bitch,1
course cooders nude trash life dmv expect,1
hoe ever fstow midnight,1
pussy as people gun knife foh appreciate people still willing throw hand,1
would love parkside sport girl dressed like kobe day everyday let see hoe,1
hoe get slayed,1
birdits planeits jake mcgee,2
jungle fever favorite movie dat white girl love dat colored man thang take hard deep drive dat girl daddy wild crazy,1
tell nick cannon bout invite wiz wildn hit wit fucked bitch dis haha,1
hoe iphone,1
man like hella thing got take hat nig,1
rub hand like bird man,2
whats youtube channel faggot,0
big booty hoe,1
cool story bitch pas blunt bitch,1
man bad built bitch san antonio cant wear thong beach as bet retweet,1
chick get fight age hoe,1
omg yall see bag weed dog bitch like fasho lmfaooooo,1
blessjesusair matthew look bird air yet heavenly father feed themare much valuable,2
yankee fan flashback remember phil hughes already still,2
back getting pregnant big deal bitch getting pregnant like else new,1
nigga fuck aint none shit goin nigga nigga think feeling bitch nigga,1
someone probably told god trash,2
ima knock pussy like fight night,1
hoe man dont need though need pick mine back,1
hoe phase,1
push bitch car like gucci mane bitch,1
fuck yall faggot next,1
ayy nigga dapussy lettin dat muafucka breathe,1
mormon hoe,1
blue flag brite bitch blowing like play bagpipe,1
son bitch cant wait till baseball back americaspasttime,1
ugly bitch definitely disguste ewww yuck,1
wan talk shit friendship fuck bitch hope offended,1
score flappy bird higher bronco score right,2
guy think slang around bitch without offensive apparently,1
look lying as bitch couldnt finish school stripping mind as bitch,1
bitch spread rumor,1
aint hoe day,1
thought raining sound roof bird exploding heat,2
kill bitch think got low body count hoe,1
theyre young lady got hoe,1
green grass tree trash,2
rarely drink drunk bitch irritate,1
happy birthday bitch,1
bitch try suck strap thats getting kicked,1
man fuck bitch,1
gon put wan eat pussy like saiyan mention theyre savage enough,1
bitch born pound sephora mac face thats natural face,1
nigga goofy act like bitch aint lyin,1
still craving oreo mcflurry,2
drop niggah,1
death attention hoe,1
nigga went get homeboy texted naw bitch,1
nah thought photoshopped face faggot smmfhi hate yall,0
officially earned right bitch thing next two year yay,1
alright time cheesecake trash,1
someone come take brownie away eat whole pan,2
hell taught fuck bitch toot,1
naaaa faggot soi guess wouldnt around longwould,1
took bitch month put scarf smfh,1
barkley trash,2
stupid fucking cunt,1
bitch sound like shes gettin raped othercats lmfaoo thefuckkkk closing window whore cat,1
rayrice still bitch got one wrong woman fan livid noexcuses,1
bitch called back lie,1
seperate nigga dont trust nigga aint starve wit bitch didnt fuc,1
greenyellow fuel pump dieselstation,2
feel like bitch calling cop people rather bitch jail someone get hit wreck less driver,1
college party dont see bitch,1
cuz people work bitch shit talker yeah dude need girl night,1
cant eat pussy thats got hair even sure really know eat pussy,1
sooo first aidcpr certification came handy tonight glad didnt lose monkey,2
bitch annoying getting left,1
nasty smoking cigarette youre nasty washing behind ear everyday stupid little bitch,1
nigga hoe suck wayans brother funny jamie foxx number,0
got get rid trash as alex smith,1
ifwedate eat pussy better lesbian,1
little closer bitch,1
bitch shut hand flower selling light change,1
ugly as niggah chuu baka anyways niggah look like,0
bare as cunt hear,1
last thought bed mock election grade voted perot maybe related really big ear idk,2
stop bitch,1
lack smh nigger music knowledge,1
minos caption nah bitchwere gon keep virginity,1
pussy good cant pull ever,1
text nigglet,1
whats difference three nig nog,1
cruise recent comment make bigger douchebag charlie sheen didnt even tiger blood,1
start liking hoe dont really like give pussy consistent basis,1
hoe feel like photo didnt get enough favorite,1
weird racist bitch,1
patrick aint nottin hood nigga top bitch nigga,1
thugga let bitch suckem rental,1
uhh bitch never overplayed itv,1
sassy white trash change username,0
youre sensitive pussy whooped sense humor neo zoom maxi dweeb sit as way,1
see hoe hurrrr,1
beautiful fairy pool near glenbrittle isle skye scotland,2
well good morning early bird minus min thee clock breakfast shower rub one sleep,2
neighborhood nigga like aint supposed get pussy like,1
officially dubbing nasty unnatural shade red look good one usually see ghetto hood red,1
fuck got curfew break bitch tho idgaf could fuss curse get home lmfao,1
quit talking shit fucking faggot youre seriously mad one want fuck even think,1
math forever confusing retard,1
gusta pollo espaol lol,2
jimmy fallon prank getting yankee fan boo robinson cano amazing via,2
really barnicle anthony weiner clown show teabaggers rich come msnbc want good rating morningjoe,1
bitch dont want real job become stripper lol lol,1
run pussy,1
actually cry bitch,1
hoe aint got manner,1
imma shoot bitch,1
dont watch fashion show bigger boob pancake bitch lol,1
art shit life forever bitch keep change,1
putin pushing land china completely revamping armed force youre fucking retard stay country,1
errybody dis bitch getting tip whisper errybody dis bitch getting tipsy,1
oreo life,2
mama raised bitch right,1
yall gon trash spirit airline travel time even let fly plane time dont,2
got pretty perfect body smart funny tall know cook good sex hoe,1
little bitch thats,1
kobe bryant bitch grow pussy,1
real gangster as nigga know play real gangster as nigga get flyest bitch ask gangster as nigga little,1
rand paul mock clinton hillaryslosers pic failed candidate,2
charlie rangel thing believe spiritual damn thing,2
narcissistic cunt,1
even get pregnant someone isnt never fit dad smh stupid stupid hoe,1
btw genocide isnt war people gaza combatant people warsaw ghetto,2
karma bitch,1
youre freshman youve fucked boy senior class youre hoe notcute,1
lil wayne fucked every bad bitch game,1
love living minnesota weather bad enough people bitch dont anything serious stay safe east coast,1
lot nigga turned bitch sketch as bitch,1
paige better text bitch lol,1
faggot as bitch nigga,0
pretend like cold hearted bitch cut instant without second thought actually,1
trash,2
pussy shit,1
youre drinking till youre unconscious feel get fine bitch,1
talkin hoe bout bronemwhy talkin hoe bout bronem,1
lol else common nigga hate sleeping heat summer bird,1
hoe care future irrelevant,1
remember watch cootie stay away hoe herpes,1
donated expensive prom dress teen couldnt afford buy one dont selfish bitch,1
die take casket club bitch twerk putting fun back funeral,1
hoe find way hoe matter,1
never talk anybody dinner family hate everyone defends people call cunt,1
greet friend bitch whats,1
bitch always trippin,1
justin beiber fucken gay cunt,0
bitch like messy bun,1
pussy,1
cleaned fingernail knife hillbilly,2
back lego club faggot,0
joe young gone shoot bitch,1
got bottle liq crib get hitting dat bitch bare liq dat,1
trent richardson trash,1
esj got ugly hoe yeah leon student aint making better fugly aint lyi,1
michaelbrown supporter say white evil albino black baby seriously tcot,0
every female trophy yall hoe certificate completion,1
one corey cory he half retarded,1
ugh put one dead center,2
trill trash cu asap said,2
youre bitch,1
fuck bitch whats real fucking address get bitch blood tell address,1
well dirty bird could middle finger since phallic giving bird necessarily wobblewibbler,2
bitch sometimes lol,1
keep around new bitch know could next dont stay line,1
hoe gon come feel,1
fuck bitch keep leg closed,1
ever kill ant sidewalk think damn nigga way get pussy,1
ill fuck til love faggot,1
dont think ive ever seen fight real world mean word fight yeah ton time damn bitch swung,1
idk think nigga like getting head gay bitch,1
real right kid haha pussy,1
nab def easy may know believe legendary curving pussy lol guilty pleasure,1
one world prominent jihadi forum got shut,2
bruh pussy talk,1
going let pussy like fight night votesos,1
rap cant getcho bitch music put mic bro,1
darky dgaf got chill wit yellow thofjulyfly outfit man,2
good pussy change life,1
ont like game wit retarded as bird,1
dude faggot pahahaha,1
hoe,1
damn joe buck making sound like greinke trash played royal chill joe,2
paul mccartney faggot,0
looked like time looked like biker bitch punk rock bitch movie,1
good pussy come smart as mouth crazy as attitude,1
lmfaoo never dolo dont got nigga old hoe fuck,0
like walking dead less carl talking bird zombie attack,2
lmao hell yea love thick bitch thick bitch love fat nigga,1
look said lls new era girl bye kill bitch kindness wht cousin,1
tweet remind time oreo milkshake run morning,2
know bitch mad throw drink got find another nigga buy another one,1
lmao year old tryna fun hoe,1
hate people leave trash car,1
girl like make hard rest wonder bitch get expose,1
shy bladder group protest rob lowe directv,2
slap bitch sense coming,1
dont know bitch tuat aint bitch sayin,1
aint bitch doe,1
bitch acting different buuut cool,1
hell perk hoe bullshit,1
pissed lad past would lick dirty sol slept,2
cussed fat redneck last day yolo,0
average need scale ghetto,2
girl talk hoe game strong,1
noveminember bitch artist year amas,1
want billion dollar bad hoe island fine as genie bitch datz none,1
hate people randomly stop talking like give reason bitch,1
biiiiiiiitch dont start haha niggggg grandma come hoe want ill try scoop today,1
willow tree pocohontas bitch year old,1
lmfaooo well fuck bitch,1
say potato pimp say put,1
