tweet_cleaned,class
want tell washington post charlie crist democrat,2
life aint nothin bitch money,1
cheer young lady foreverrrr younnnnng grab flask chug,2
like zero bitch nap thats gon stick side fall forreal tho lie,1
today using wooden thing making way around base weird,2
protest climate change leaf trash behind votingmatters,2
crazy bitch fml,1
lmao still feel played bout hoe,1
look like welfare bitch compared latinas date fuck need fashion makeup tip tbh,0
say got new bitch,1
heard mama raised like bitch,1
bitch ugly person,1
almost forgot tweet still bitch,1
coolin nig voice uhhee laugh,1
bitch crazzzyyyyyy maaannnnn,1
everybody talking rihanna nude like super cold naked cuz famous huh hoe built like bubble gum swirl,1
lebron gone dunk hoe like ease,1
si shed rather broke bitch shrug shell tell work,1
lame bitch dont fighting chance,1
envy bitch long full eyelash,1
exactly hoe twat setup,1
pornandroidiphoneipadsexxxx oldyoung german milf getting young old cock pussy,1
bitch as nigggaaa,1
pussy,1
yellow,2
dont get wrong hunt bird thats lot work well aint hungry,2
still mutt tho lol,2
hickey like yeah bitch thats mine he like even trying hide make feel good life,1
remember trash floor car upgraded put wale gifted feel like old car htt,2
ben gett pussy ben get head,1
sosa beat,1
emotional shit absolutely bird,1
khloees new backpack colored last night,2
know bitch,1
girl fucking retarded back started cramping man double,1
yankee beat grapefruit league day,2
pussy must pop severely single,1
man rather see morning selfies bitch dont change look case monday see jaybey poster ijs,1
bringing booty back ahead tell skinny bitch,1
yall popular cuz yall name bitch ugly,1
phillip river look like almost want call dude nigger bad play,0
murda mook rip shit,1
fucking thirsty championship welcome fucking traitor open arm haha fucking heart as pussy organization,1
pay pussy get many freebie,1
bitch get duck as shit,1
friend foe nicca state biz,2
fuck hot head pussy cold heart,1
refresh dhimmi seattle mayor murray poor memory city long history jihadi breeding ground,2
making pollo brasso today,2
bet pay back bitch,1
cup filled love bitch know keep one rolled,1
statistic dont lie like gun control youre queer guy,1
tired bitch,1
damn roach got dick pussy lol,1
bitch guessed,1
plot twist take lot cut bitch,1
bitch dont act crazy dont really want,1
dont fck wit luvv who pussy better crazy bitch apparently thots,1
wait min nigga bitch lol fuckthesteelers httr dont give damn cont,1
man run game aint hoe fuck alex dont even need bitch as,1
today something dope tomorrow thing trash next month irrelevant next year classic,2
last bitch bitch came trap tryna vine dope fuh likesher funeral day dat,1
idont want bestfriend boyfriend homeboy homegirl fuck yall bitch ctfu idc idc,1
bye bitch byeeeee,1
hoe gon come feel boy lol,1
life fuckin short free bird,1
rate hoe,1
nerve bitch champaign,1
nigga hate cuz know threat bitch,1
lol thirst real dis bitch,1
tiger fuckin garbage jesus christsuck dick ausmus youre trash sorry as bullpen,1
see got get money palm itchin niggahs gossip like hoe bitch,1
little bastard come unto spinellis time little wigger rap thinh try say like gon die,1
read instagram profile luv grls princess birth bitch choice yeaaah youre cool tryhard loser,1
bitch fake ask,1
lmfaooo cant bitch officially crossed line,1
lil stupid as bitch aint fuckin wit,1
daniel there cow tipping hoe down jackson city living lol,2
retard retweet fuckry,0
fucking half breed dog stop acting,1
dude said bitch took whole nap midterm,1
order real nicca got real nicca,1
week till bitch thank god,1
faggot honeybooboo imagine internet world created trap feed allah like gazelle stephenking,0
know yall bitch tell yall self wwhd would hustlelinaa cuz yall ass stay following,1
baby make pussy rain often,1
hoe still excites still growing lil,1
apparently eric fucced fuccing every nigga great yall bitch whoppin talkin behind blocced twitter,1
dont bitch someone bitch,1
bitch curved dick,1
bitch coulda store looking,1
need life bottle bitch life lesson sam houston state,1
give credit bitch went took,1
brownie bro,2
kim kardashian babyin important news took trash last night,2
dat bitch mouth made honor roll,1
waif pussy fee bye lawrence,1
went way home depot take sink pic hate hoe,1
gave aunt tupac greatest hit bitch lucky love tupac,1
fuck as redskin corner,0
nicki said fuck skinny bitchesuh,1
lol bitch funny min tossed as curb,1
charlie sheen fucking bos,1
pig drink gallon water every day still arent thirsty hoe,1
lil bitch aint knowyou never score sideline hoe,1
camo day catch school huntin basic bitch,1
pornandroidiphoneipadsexxxx latina latina tight pussy,1
back elementary school line leader everybody else bitch,1
fuck bitch,1
let text hoe sumpin,1
slap hoe as like birthed,1
tired mom making stay finished drinking another beer better chug shit,1
peace faggot,1
feel see nothing wrong gta killing sole purpose game,2
people bitch as nigga stay far away,1
there lot big booty bitch pharr gym,1
year old girl struck babe ruth lou gehrig back back banned baseball yankee,2
lord help bitch,1
hugh hefner lived life men dream man still gettin pussy want,1
guy tell doesnt eat pussy sudden dont suck dick anymore centeral washington university,1
niccas use like always tryn pull finesseduh nicca need mine,1
dont vote cripple amirite bigot vote votewendydavis governor texas,2
fucking retarded cant say single thing house without blowback,1
lmao really call hoe lol yeah hoe,1
dont get bitch blame hoe man cheated withit faulttheir boyfriend couldve said,1
talk morning hoe rapper damn yall talk shit everyday,1
mother isnt allowed make brownie,2
fuck bitch done xavier hopefully respect girl alone dont want,1
stephen threat brother doesnt scare quit runnin fuckin mouth wont hide behind brother bitch boy,1
customer tryna act like dont understand theyre saying bitch dont understand saying,1
hate people ask tryna look good bitch bye,1
bitch stop lien,1
close could bitch going zip scorecard rightful mercy stoppage,1
neice getting big ready punch sum bitch lol,1
ill always remember feeling like good like couldnt like whack bitch could lied,1
chit shake monkey beeotch,1
ion give fuck ion give fuck ion ion ion give fuck bitch dont give fuck anything,1
hell act proper live richardson much finer hoe ducanville,1
fuck huggin kiss fuck bitch,1
shit bird,1
ugh bitch name leather,1
ready make today bitch,1
mom ive dropping excuse done fake bitch done grad,1
pick bigger twat james blunt robin thicke,1
read slant orig statement said everything havethat extreme comment made,2
highest score flappy bird cant beat,2
bitch took phone,1
slut opp thot hoe,1
please excuse bitch as phone hoe lately,1
huge yankee fanenjoy,2
gigantic big faggot chubbs bout earl,1
havent seen hoe,1
bitch went full retard,1
pussy,1
smoke like backwoods day cop dem bitch box woe,1
fucked bitch cause gave boner went twice like adrien broner freckbars,1
gay girl suck pussy bitch took plan pill day mean munching hoe ate plan,1
swear bitch talk love attitude bruh lhhatl,1
chunky nugs doesnt even hook like,1
pau hoe gon play trade deadline,1
dear von miller karma bitch,1
apparently like takin picture he eatin pussy,1
denzie boutta takin erry body bitch,1
gay gabrielle bad fuck even though bitch bad cant cheat dimefoh lol,1
quisiera amarte puedo mama dijo dont love hoe,1
black girl never guess cause dont call hoe sell drug shoot nigga well,0
cant handle people give attitude dead quick like nasty bitch,1
yeah bitch,1
bitch like,1
hillbilly like sport,2
hoe want love bad,1
baddest bitch didnt win queen fuck mexican ill buy house,1
youre watching seahawks game youre hella bitch,1
wish nighas stressed kid like stress lame bitch,1
history test made bitch haha,1
fella take note eating pussy keep lip soft,1
tegenwoordig weet ook niet wat voor vlees eetvoor weet zebra een aap,2
bitch quick say let pull phone,1
well togetheryu job hoe,1
saw crow gallop across road mmkay wut,2
get degree first bitch,1
nigga bitch got quit wit money pic count accurately aint enough,1
dumb ugly stupid bullshit as bitch,0
straight like chaser bitch solid five wedding day nigga,1
lol morning hoe,1
watching deadly woman malicious bitch left baby sun bake death wtf,1
zuko get bitch,1
really exploding giant yellow duck youll appreciate,2
kris griff ghetto know anything sperry van,2
bitch tellin,1
froyo brownie dinner tonight adult making executive decision,2
finna pic bruh hoe funny,1
isi jihadis discus buying selling yezidi girl slave tcot pjnet,2
two bad bitch giving head dam time oldpics lol aww,1
lol bitch aint shit,1
swear god nigger better still hang work got hype,0
honkey as bitch tryna tell shit,1
old lady went pay reached way plate hate eating bar countertop stupid white bitch,1
idc cute shit dont matter got trash personality,1
aint nuttin cut bitch,1
straight hoe weak,1
big bro thought house party pajama jam like bitch,1
yankee gave win happy birthday,2
teaching bitch clear bong mon,1
nice baby bump bitch,1
wouldnt trust male cheerleader cuz cimarron got one got allll bitch,1
get pussy,1
cant get many hoe flexed last night,1
youve ever drunk fish might redneck,2
rsurge charlie bakerr point demostate mass coakleyd dog via,2
mei haruka tied take three cock pussy andmouth,1
briahna told best advice ever gave aint nothing cut dat bitch lmao,1
worker talking whats twitter name hoe could never screen shot bos,1
easy way female calling hoe asking want ketchup fry,1
hoe tbh highest key,1
katys grand exit tonight firehouse hasta bye bye bitch,1
real life online follow sorry folk cause look like border hopper dont mean one born raised,0
ram fag,1
ill say woman want couch plain sight outchea bitch simple,1
avoiding commitment hoe aint loyal,1
people shooting gun around late fuck got thinking tryna shoot black as jammin jiggaboo music,1
fucked know every niggah want,1
hey send song need put hoe bang ride around,1
love bffl dont even smoke bday bitch gone turntttt,1
made bitch sicc wit one,1
dyke anything,1
one wrong move consider bitch mine,1
call bitch thief get smdh,1
bro bitch really stood like gon give penny,1
done went wit hoe frfr judge,1
bitch bad like brittany wish brittany,1
asshole mother shoved coat hanger pussy gouged death harmless fetus,1
beat pussy,1
need awarethats alot going world yall flagrant ass care know abo,1
come pussy as come as mouth way wont tell nobod,1
breezy got sleep hoe,1
pornandroidiphoneipadsexxxx ebony ebony texas bbw big deep pussy,1
dick game make faithful bitch start cheat,1
love bitch say youll remember baby say youll remember love end time,1
son bitch moment walking house dark stub little toe wall,1
snail hoe parent left gon gone min snail snail hoe horny snail,1
bitch flawless,1
hate bitch say dont care nigga broke got nothing going acting like fake,1
psa big booty hoe tig bitties xbox onepancake booty hoe pancake tit,1
woke bed full bitch aint even fuckin,1
eating pussy top shoulder,1
fucking told bitch,1
bitch as chick flick ever sad movie,1
bitch,1
like hell bitch meanwhile bitch like hell clique ayeeeee,1
fatherless wallet carrying as video game playing as negro breh filth way afford date twitterhoney,0
dont offended word youre bitch who looking something bitch,1
fuck faggot grow gon old as man still playing video game,0
flappy bird suck dick lick ball swag,1
still put pride front feeling yes bitch still childish,1
dont nigga want broke bitch,1
plot twist bitch,1
every cartoon alway saving hoe lmao lmao damn captain saveahoe,1
tweet somn laugh bitch wan spoil fun getting serious,1
figured shocked hoe old tweet lol,1
level bitch cant fuck nigga cause like red bottom cant afford nigga got benz riding honda accord,0
shes cunt hoe bag,1
karma bitch,1
carol gon george lenny bitch,1
bitch coach said didnt like attitude,1
florida retard,1
people work company tend trash,2
love jigg jigg,2
text bitch,1
looking ill bitch mind,1
chop bird call flap hand,2
smoking weed unattractive haha trying get high bitch trying turn,1
oreo frappuccino,2
nigga talk bitch day,1
naw dude wish theyre white trash,0
retarded,1
never ever ever give nigga unless know fact yeen finna play bitch,1
brown redskin shouldnt considered nfl team,2
cool str know yall got wrong bitch understand,1
female grand champion jesse heard bird outside,2
bitch dont avoid wan spoil,1
youre good listener twitpic selfie bad bitch,1
allah kiss as yes muhammed bitch like osama binladen,1
hood nigga bitch love emojis lmfao,0
like brownie,2
alex rodriguez lucky ryan dempster hit going get camel break neck son bitch,1
hoe day like,1
fuck try nice fuck ape shit stay mad wtf haha,1
hanging daney ari today bitch,1
shut faggot,0
agreed badd one idkmixxed bitch really tho,1
deez hoe actin,1
ive shot yellow smoke,2
charlie sheen real major fucking respect charlie sheen,1
floyd please deliver temptation wish bitch would hurry thee fuck surfboard bed,1
bitch think cute guy hunny fake asf like weave dont even like stfu,1
beg differ lip bittin shit dis bitch bit lip tried suck blood aint shit sexy,1
shes sapiosexual jimmy neutron brain blast showed intellectual put pussy chainwax,1
yall know thankful bitch lmaoo sister funny,1
there like injury game football shit trash lol,1
okay shit hoe,1
bitch meet,1
lmfao bed whitey,0
good niggah lol,1
bitch spoil,1
fuck nigga feeling fuck nigga bitch,1
think term redskin offensive political issue ignorant,2
hoe always talkin shit guy look bitch gon talk shit ill happy smack,1
here thought dont valentine mean ugly bitch haha,1
shut bitch focus tomar,1
bitch luv throwing bread crumb ground complain pigeon come flocking towards,1
high hoe hitting bowl nigga rick riprick,1
check yer phone nigger,1
crazy bitch hilarious,1
see saturday dont show bitch made nigga pussy as nigga,1
trying cat fish like nuh bitch get back,1
got hoe dick duct tape stapler,1
keshawn martin soooooooooo fucking trash,1
right spam eating pussy might well eat as,1
ima fuck nigga omar weed brownie,1
good one fag boy,1
give away pussy like loose change,1
bitch dont give fuck say dont fuckin lie hairy bitch,1
good girl worth bitch,1
favorite fucking jam havent seen judging little girl probably trash,1
hoe want sum good dick attention hbcu,1
man trying eat nigga said bitch showed nothin,0
happy hour time best time day nigga dont know bout happy hour hoe,1
niggaaaaaa bitch trip hard nigga realize theyre gon grow regret fool,1
coming soon bitch nigga monstertape,1
mind clear bird crashed side head,2
thats lil nigga middle locked wid bitch,1
hoe needa stop tryna split relationship get theyre damn man,1
tell itty bitty bitch pipe,1
yooo thinking bout day lol really speaking one person niggah,1
spend money weed clothes food hoe,1
real nigga handle anything including bitch nigga,1
chaber book bragadayjah nimrod cushite first king earth see bragadayjah,2
hoe know,1
going hurt bitch as feeling,1
eli manning look like idiot he talking guy sideline hand like retarded,1
hbic head bitch charge lol,1
say wrong treat pussy right,1
stop fuckin jail bird nigga thats serious as play scare shit sus,1
tbh left hoe alone,1
retweet fucked someone bitch,1
hey dis angry white man called nigger didnt answer door time aint fit delivering pizza,1
controlled aux cord whole two half hour drive home didnt repeat single song bet boyfriend couldnt bitch,1
real men eat pussy,1
traffic gable,2
cheated bitch lol nobody even wanted committed shit,1
ima hypocrite ill say dont fuck hoe day later let hoe play dick mcdonalds drive thru love fry,1
many nigger store knooooooow stealing,0
tryna get bitch linkedin,1
miami run defense alex smith trash,2
forgot retarded lol lem break hoe lmao,1
bitch swearing pussy soooo good nonsense,1
lmao twitter little bitch as site need start using hoe,1
california home skater trash,0
dont hoe haha,1
understand stop venting bitch give much insight life people dont deserve,1
yall cool cold chasing hoe,1
karma biggest bitch youll ever meet keep pushing button,1
okay closet fag,0
girl like love babe bitch isnt today,1
flipping thru saw bachelor stooped second say hoe garbage,1
kanye said dont need pussy bitch dick,1
bitch really happy got follower getting kicked moving car abusive almost dyi,1
follow fag birthday today,1
niggaz get emotionaaaal remind bitch,1
somebody toss bitch dasani something gurl thirsty,1
ima get wifey cunt spread leg anyone settle nothing rarest difference better lmao,1
waiting brownie want brownie someone hook,2
nah nicca got gas blowing gas,1
homie reallly love fat bitch like love,1
yuh bitch as ull get smacked quick,1
fuck bitch,1
many hoe really,1
free niggah,1
ugly bitch get love,1
trash plain fuck come elephant print,1
thing irritating donald sterling cunt adam silver continually apologizing,1
science bitch thewalkingdead,1
cuz thought got wife picked hoe lovin song man keep coming,1
check got vodka soda lemon bottom bitch thats cool,1
nashville atlanta houston many trash driver,1
kno wan roll bitch like,1
lmfao alcohol,2
many pretty bitch got sore throat voicemostly red bone turnoff,1
twitter like real lifefilled pussy,1
aint lil nigguh stfu glory god lmfaooooooo,1
black girl ghetto,1
aint get trap houuuse,1
lmaoooooo eat goal faggot,1
dont sorry hoe careful,1
really expand bitch money,1
people ever twitter bitch get mother fuckin diary,1
pussy scrapehouse visit,1
dont surprised bitch youre always dick towards,1
telling like green otis redding stop missing point dont call trash tell,2
guy day act like dont care pussy easy thats thing matter,1
ratchet as bitch gon nobody blame get std,1
dis one sexy bitch,1
summer hoe turn winter wifeys,1
ion got bitch as thang dont like wtf saying unfollow,1
joe stop telling pbo job couldnt even keep job teabagger florida morningjoe,2
bitch face bitch voice match kinda hard making friend,1
neither justwhyok ive never nigger cock,1
also love angry old irish bartender pussy one beer ask glass water fuck ignore shit,1
call chief weak bitch,1
free brother turt bitch,1
savage day like colored dat wrap day hoe like mummy,1
hickies thigh right pussy right,1
way many pussy lay nothing generation literally figuratively,1
lay bitch,1
okaaaaay bitch never care edge still laid,1
side bitch main bitch main hoe aint feeling,1
love salad anyway fuck hoe eat salad,1
sheehey back door cut still guarded hoosierhoops hoosier,2
flappy bird make smash phone face,2
fit lad nice gear scally lad trainer would get,2
gone day dont bitch as miss,1
nigga gone get room like bitch,1
damn bitch really hoen,1
cmchat think hard forhick hopget major air time station cmchat,2
know bitch,1
chinese maverick communicating comrade know giving imperialist yank birdie,2
train station harrys trash ive eurostar refunded whole trip paris train accident,2
shout bitch dont designer shit still look better yall bitch everything desi,1
lmaoooooooo dangelo prolly nice shit madden lmao fat bitch,1
faggot agree,1
fuck bitch never loved thot,1
man order inch sandwich subway pussy bitch fact,1
miss lil bitch,1
yes love hair pussylol,1
real bitch,1
hate hoe looking nice nshit hair nail done kid look like barely survived tornado,1
shaved pussy get serious anal sexhere,1
hypocritical little bitch,1
quit hating oyster lookin as bitch,1
acted like hoe broke wrong thinking hoe along,2
far tell coon track cab door window tractor parked tree away home,2
ill show chug beer,2
dean cry need pee peter keep saying nigger,1
good girl worth bitch people still fail realize,1
phat pussy best pussy,1
dat nigga hoe cant stand,1
find funny fag write looking grindr lol thats fucking dumbass,0
juicy cant say ratchet pussy remember,1
aint nothing cut bitch,1
got problem bitch aint one shes need michane gun,1
push wall slowly take panty write alphabet tongue tight pussy,1
one manager tried talking stay till aint nobody ordering walked shmoove bitch,1
smart wont pretty forever bitch,1
people really think asian get offended even though make fun gook self,2
wonder bitch dead yet,1
horrible invader zim trash,0
fair youre still faggot,1
shy bitch homosexual,1
someone clearly stinky as beaner,0
hard keep hoe,1
think yall losing yall nigga cuz season changed yall seasonal hoe,1
tyler creator said rape pregnant bitch tell friend threesome,1
ghetto as pocahontas,1
put bitch figure bedrock,1
bitch love sodaa,1
niiice nigga schinder pullin hoe,1
lol get eden youre bitch fat,1
pussy,1
ohh bitch might pas lol,1
people realize jig,2
faded swear god faded bitch educated client pay payment,1
steal nigga bitch dont steal nigga tweet,1
add snapchat bitch erinblair,1
trend vine acting like woman like nigga couldnt wait faggot,0
got cotton mouth eat pussy,1
paul gon pick ball score bitch thevrefs warrior bench without getting,1
hope making moneyylol aye whr hoe,1
wan state record dont hoe,1
lmao ive always wanted skibust as innat hoe fit,1
boy break new girlfriend couple day later something didnt know abo,2
fucking hot boot doesnt love boot boy lick sol clean,1
sierra almost got caught ole hick,2
let try attempt first day work cold haha yeah right fucked car bitch,1
bitch corny claim happy cry everyday ooh iight hmmmm,1
wussup pussy imback newtwitter,1
hate point truth people flip script like youre wrong bitch,1
tit may better looking face make like asian latina tranny fact,0
burnt pussy lip gal blue throwing,1
seen planet ape brazil highest number monkey specie nation world,2
wasnt work place deck aye fucking right give tyson combo end uppercut shut fuck bitch,1
pull make bitch mad,1
blunt head fuck fed eat pussy till tongue red,1
got bitch dont ever readem top,1
punched nose accident shocked crap bitch hurt,1
dont play bitch there take back,1
dont want pussy make want pay bill sleep sunday morning away dont ruin life,1
put as dicc let know baddest lit bitch,1
bitch vagina little resilient,1
worried bout hoe cuz hoe aint worried bout another hoe,1
funny swaggot white boy wan act like theyre ballin till come time tip sad as cracker,1
bastard obama giving fing wetback,1
fuck hoe look sad,1
waiting bitch,1
wearerepublicnotregime potus violated usa sovereignty wopen borderjihadiscriminaldiseasedhaitianssamericans impeachobama,2
omarion girl negative as vibe hate mama like hoe need,1
nobody want nigga take expensive date dont expect pussy cause took girl like,1
get offended tweet youre bitch,1
bitch,1
assuming got cup pussy got bicep wtf,1
whops yardie smoke blunt tell nigga come stressed,1
yeswedid attack harass threaten mock bully woman minority dared fall line progressive,2
cant fuck bitch nigga desert dick,0
whatcha say hoe know hoe,1
head always think young nicca gon runoff wit sacc,1
hol bitch,1
lol fact baddest bitch porn star stripper,1
nigga use term yassssssssss gon assume fag,1
whered get beauty scar tough guy eating pussy scarface,1
bitch,1
mine pussy,1
two foreign hoe iont like basic,1
freeze bitch gon steal heart,1
yeah bad hoe,1
stfu prude as basic as bitch,1
hate bitch fact oomf like retweeettt,0
wan watch nigger made christmas,1
cut porkchop canned pinto bean small carrot corn celery potato cayenne powder crushed red pepper,2
ghettosdriven liberal ideology forged union bankrupted selfserving dems catering parasitestcot,0
geez think northkorea may right barackobama monkey surely act like one,0
like found edit facebook comment trending topic twitter think hear abo,2
never trust bitch cause bitch fuckin anyone say know faithful bitch got get one,1
ctfu bitch talm bout need respect,1
fat bitch want skinny bitch cant cook nothin hoe aint hungry,1
oreo stuntcome thru,2
charlie bit,2
told midget hoe start stripping,1
blessjesus amos two walk together except agreed,2
ill never understand people fake entire relationship cant even fake hello bitch fucking,1
truth ate yellow snow child,1
say hoe hoe hoe ewww nasty mean daily ill spare detail lol,1
atleast let knowur faggot keep type twitter secret,0
idgaf thats sound illogical twitter bitch,1
side hoe need round always play stupid hoe song back back,1
igot level far flappy bird smh,2
slut whore hoe,1
shade shit bitch yourwifecantread,1
pulled bulbasuar know bout make girl pussy sore,1
ice fish get look really trash,2
northside wildbills come check left hoe alone,1
fuck michigan many wan thug ask yall pussy bitch next year,1
shes really nice get know shes bitch youll get used,1
yeah okay let put fire cracker cow pie see happens,2
lil spook yung lean robb night,2
youre nigger pick cotton,1
thing collegefession taught fact hoe aint loyal stony brook,1
bet trash as self petty,1
mykel stay wit bad bitch,1
girl plain looking borderline ugly chunky hey least shes got nice smile great personality,1
pussy as hoe nigga cant fuck wit yall,1
lem throw hows tranny,2
real vampire nigger,1
faggot,1
say dat shit bad bitch hate broke niggaz knew already,1
cant tell anything bitch one click away google time,1
fuck bitch saying hood love,1
heard pussy nigga hatin,1
yeah eagle definitely arent finishing division year bitch,1
ebhgjhbgjbejfb saw ach websingle xxxxx marylandunempins like bitch named mary landunem stole money,1
fucken bitch wifi,1
yall heard rich gang tape thou bitch flame,1
wan know crazy shit without sunshine could find shady bitch,1
bitch average spend money got girl want gon get fucked aint askin,1
mother fuck everything got going today going vega hour bitch,1
clever watch burfict make hit mock official throwing flag,2
bitch,1
hoe sittin floor damn couuuuuch birthday feb naa nope,1
